tarehe_ya_data,month,season,begin_time,end_time,hours,lon,lat,region,district,kijiji,mwalo_bandari_diko,sehemu_aliyovua_locality,idadi_ya_wavuvi_chomboni,aina_ya_mtego,aina_ya_samaki,Groups,local_name,uzito,idadi,cpue,cpue.check
02/01/2020,1,NE,2020-01-02T21:00:00Z,2020-01-02T23:29:00Z,2.48,39.01571,-5.51463,Unguja,Kaskazini A,Mkokotoni,Nungwi,Mkuru q,16,GN,Mackerel(scomber),Mackerel,NA,200,10,80.53691276,80.64516129
03/01/2020,1,NE,2020-01-03T09:40:00Z,2020-01-03T13:10:00Z,3.5,39.17992,-4.7809,Tanga,Mkinga,Zingibari,Petukiza,Mwezi,19,RN,Sphyraena putnamiae,Dermesal,NA,NA,NA,0,NA
03/01/2020,1,NE,2020-01-03T19:00:00Z,2020-01-04T05:00:00Z,10,39.23,-5.083,Tanga,Muheza,Kigombe,Kigombe,Majivike,20,RN,Sardine,Sardines,NA,400,20,40,40
03/01/2020,1,NE,2020-01-03T19:00:00Z,2020-01-04T05:55:00Z,10.92,39.24,-5.22,Tanga,Muheza,Kigombe,Kigombe,Funguni,18,RN,Sardine,Sardines,NA,400,20,36.64122136,36.63003663
03/01/2020,1,NE,2020-01-03T19:15:00Z,2020-01-04T05:00:00Z,9.75,39.08572,-5.04011,Tanga,Tanga City,Sahare,Kasera,Mbolea,12,RN,Atule mate,Mackerel,NA,40,2,4.102564103,4.102564103
03/01/2020,1,NE,2020-01-03T19:53:00Z,2020-01-04T05:52:00Z,9.98,39.22581,-4.72808,Tanga,Mkinga,Zingibari,Petukiza,Sihi,21,RN,Sardine,Sardines,NA,200,10,20.03338898,20.04008016
03/01/2020,1,NE,2020-01-03T20:03:00Z,2020-01-04T05:03:00Z,9,39.29006,-4.81365,Tanga,Mkinga,Zingibari,Petukiza,Chundo,22,RN,Dussumieria acuta,Anchovy,NA,20,1,2.222222222,2.222222222
03/01/2020,1,NE,2020-01-03T20:03:00Z,2020-01-04T06:30:00Z,10.45,39.29006,-4.81365,Tanga,Mkinga,Zingibari,Petukiza,Chundo,22,RN,Dussumieria acuta,Anchovy,NA,20,1,1.913875598,1.913875598
03/01/2020,1,NE,2020-01-03T20:03:00Z,2020-01-04T05:03:00Z,9,39.29006,-4.81365,Tanga,Mkinga,Zingibari,Petukiza,Chundo,22,RN,Dussumieria acuta,Anchovy,NA,20,1,2.222222222,2.222222222
03/01/2020,1,NE,2020-01-03T20:15:00Z,2020-01-04T05:07:00Z,8.87,39.31232,-4.77206,Tanga,Mkinga,Zingibari,Petukiza,Chundo,40,RN,Stolephorus commersonii,Anchovy,NA,300,3,33.83458646,33.82187148
03/01/2020,1,NE,2020-01-03T21:00:00Z,2020-01-04T05:15:00Z,8.25,39.35066,-6.7896,Dar es Salaam,Kigamboni,Minazi  Mikinda,Minazi Mikinda,Katumbi,25,RN,Sardine,Sardines,NA,400,20,48.48484848,48.48484848
04/01/2020,1,NE,2020-01-04T21:40:00Z,2020-01-05T04:55:00Z,7.25,39.24027,-6.30317,Dar es Salaam,Kinondoni,Kunduchi Pwani,Kunduchi Pwani,Pungume,23,RN,Sardine,Sardines,NA,600,30,82.75862069,82.75862069
30/01/2020,1,NE,2020-01-30T19:30:00Z,2020-01-31T06:00:00Z,10.5,39.6134,-5.30075,Pemba,Pemba Kusini,Mbuyuni,Ngazini,Mtipe,22,RN,Sardine,Sardines,NA,320,4,30.47619048,30.47619048
31/01/2020,1,NE,2020-01-31T19:23:00Z,2020-02-01T02:24:00Z,7.02,38.91457,-5.89383,Unguja,Kaskazini A,Mkokotoni,Nungwi,Mkwaja,20,GN,Dussumieria acuta,Anchovy,NA,130,65,18.52731591,18.51851852
31/01/2020,1,NE,2020-01-31T20:00:00Z,2020-02-01T05:00:00Z,9,39.6123,-5.30673,Pemba,Pemba Kusini,Mbuyuni,Ngazini,Mtipe,19,RN,Sardine,Sardines,NA,160,8,17.77777778,17.77777778
02/02/2020,2,NE,2020-02-02T06:08:00Z,2020-02-02T11:00:00Z,4.87,38.98449,-5.63845,Unguja,Kaskazini A,Mkokotoni,Nungwi,MWANJA,16,GN,Dussumieria acuta,Anchovy,NA,200,10,41.09589041,41.06776181
02/02/2020,2,NE,2020-02-02T19:26:00Z,2020-02-02T19:26:00Z,0,39.05993,-5.65286,Unguja,Kaskazini A,Mkokotoni,Nungwi,Kwale,20,GN,Mackerel(scomber),Mackerel,NA,160,80,Inf,Inf
02/02/2020,2,NE,2020-02-02T20:00:00Z,2020-02-03T05:30:00Z,9.5,39.63226,-5.30271,Pemba,Pemba Kusini,Mbuyuni,Ngazini,Kwamzungu,22,RN,Scomberomorus plurilineatus,Tuna,NA,24,12,2.526315789,2.526315789
03/02/2020,2,NE,2020-02-03T07:00:00Z,2020-02-03T09:30:00Z,2.5,39.3951,-6.84737,Dar es Salaam,Kigamboni,Minazi  Mikinda,Minazi Mikinda,Kijiweni,16,RN,Auxis rochei,Tuna,NA,80,4,32,32
03/02/2020,2,NE,2020-02-03T20:18:00Z,2020-02-04T05:42:00Z,9.4,39.15807,-4.78485,Tanga,Mkinga,Zingibari,Petukiza,Lawanda,22,RN,Sardine,Sardines,NA,400,20,42.55319149,42.55319149
03/02/2020,2,NE,2020-02-03T21:00:00Z,2020-02-04T05:45:00Z,8.75,39.22,-5.04,Tanga,Muheza,Kigombe,Kigombe,Jarange,16,RN,Mackerel(scomber),Mackerel,NA,120,6,13.71428571,13.71428571
05/02/2020,2,NE,2020-02-05T08:00:00Z,2020-02-05T13:00:00Z,5,39.42503,-8.79501,Lindi,Kilwa,Kivinje,Magengeni,Luwangale,17,RN,Caranx tille,Caranx,NA,40,40,8,8
07/02/2020,2,NE,2020-02-07T06:05:00Z,2020-02-07T10:11:00Z,4.1,41.56324,-9.254861,Lindi,Lindi,Benki,Beach,Kera,25,GN,Decapterus kurroides,Mackerel,NA,NA,30000,0,NA
07/02/2020,2,NE,2020-02-07T08:00:00Z,2020-02-07T09:50:00Z,1.83,39.12386,-5.09247,Tanga,Mkinga,Zingibari,Petukiza,Majini,37,RN,Auxis thazard,Tuna,NA,160,2000,87.27272729,87.43169399
07/02/2020,2,NE,2020-02-07T08:00:00Z,2020-02-07T09:50:00Z,1.83,39.12386,-5.09247,Tanga,Mkinga,Zingibari,Petukiza,Majini,37,RN,Auxis thazard,Tuna,NA,160,2000,87.27272729,87.43169399
08/02/2020,2,NE,2020-02-08T05:11:00Z,2020-02-08T05:48:00Z,0.62,39.12586,-5.09247,Tanga,Mkinga,Zingibari,Petukiza,Majini,37,RN,Auxis thazard,Tuna,NA,200,300,324.3243241,322.5806452
08/02/2020,2,NE,2020-02-08T11:43:00Z,2020-02-08T17:46:00Z,6.05,39.12586,-5.09247,Tanga,Mkinga,Zingibari,Petukiza,Majini,37,RN,Auxis thazard,Tuna,NA,200,300,33.05785124,33.05785124
09/02/2020,2,NE,2020-02-09T05:00:00Z,2020-02-09T06:40:00Z,1.67,39.12386,-5.09247,Tanga,Mkinga,Zingibari,Petukiza,Kitongamwe,30,RN,Rastrelliger kanagurta,Mackerel,NA,6,2.5,3.599999999,3.592814371
09/02/2020,2,NE,2020-02-09T08:00:00Z,2020-02-09T13:40:00Z,5.67,39.12386,-5.09247,Tanga,Mkinga,Zingibari,Petukiza,Bunju,15,RN,Caranx tille,Caranx,NA,50,5,8.823529411,8.818342152
09/02/2020,2,NE,2020-02-09T08:47:00Z,2020-02-09T14:30:00Z,5.72,38.99597,-6.26209,Pwani,Bagamoyo,Mwambao,Kastam(Custom),Manyema,46,RN,Decapterus kurroides,Mackerel,NA,200,10,34.98542274,34.96503497
10/02/2020,2,NE,2020-02-10T06:58:00Z,2020-02-10T09:59:00Z,3.02,39.26024,-6.70257,Dar es Salaam,Kinondoni,Kunduchi Pwani,Kunduchi Pwani,Bongoyo,40,RN,Sardine,Sardines,NA,600,30,198.8950276,198.6754967
10/02/2020,2,NE,2020-02-10T07:00:00Z,2020-02-10T13:00:00Z,6,39.54422,-8.59675,Lindi,Kilwa,Somanga,Mbuyuni,Makatoni,14,RN,Rastrelliger kanagurta,Mackerel,NA,54,3,9,9
10/02/2020,2,NE,2020-02-10T08:25:00Z,2020-02-10T13:30:00Z,5.08,39.02893,-6.3882,Pwani,Bagamoyo,Mwambao,Kastam(Custom),Mwambakuni,42,RN,Decapterus kurroides,Mackerel,NA,40,2,7.86885246,7.874015748
10/02/2020,2,NE,2020-02-10T09:30:00Z,2020-02-10T14:00:00Z,4.5,39.43643,-6.85517,Dar es Salaam,Kigamboni,Minazi  Mikinda,Minazi Mikinda,Kimbiji,15,RN,Sphyraena putnamiae,Dermesal,NA,NA,NA,0,NA
10/02/2020,2,NE,2020-02-10T22:30:00Z,2020-02-11T06:15:00Z,7.75,39.53586,-8.73436,Lindi,Kilwa,Magengeni,Magengeni,Mawarani,44,RN,Amblygaster sirm,Anchovy,NA,160,20,20.64516129,20.64516129
11/02/2020,2,NE,2020-02-11T06:45:00Z,2020-02-11T12:30:00Z,5.75,39.13464,-9.21345,Lindi,Lindi,Benki,Beach,Mwitingi,13,RN,Auxis rochei,Tuna,NA,145,250,25.2173913,25.2173913
11/02/2020,2,NE,2020-02-11T07:30:00Z,2020-02-11T12:00:00Z,4.5,39.54522,-8.59775,Lindi,Kilwa,Somanga,Mbuyuni,Fungu mbili,14,RN,Rastrelliger kanagurta,Mackerel,NA,24,2,5.333333333,5.333333333
11/02/2020,2,NE,2020-02-11T08:28:00Z,2020-02-11T12:28:00Z,4,40.39243,-10.27424,Mtwara,Mtwara Rural,Mnazi,Mnazi Bay,BWANAOGA,17,RN,Sphyraena barracuda,Dermesal,NA,10,1,2.5,2.5
11/02/2020,2,NE,2020-02-11T08:35:00Z,2020-02-11T12:26:00Z,3.85,39.05767,-6.36051,Pwani,Bagamoyo,Mwambao,Kastam(Custom),Boribo,46,RN,Decapterus kurroides,Mackerel,NA,400,20,103.8961039,103.8961039
11/02/2020,2,NE,2020-02-11T08:35:00Z,2020-02-11T12:26:00Z,3.85,39.05767,-6.36051,Pwani,Bagamoyo,Mwambao,Kastam(Custom),Boribo,46,RN,Rastrelliger kanagurta,Mackerel,NA,120,6,31.16883117,31.16883117
11/02/2020,2,NE,2020-02-11T09:30:00Z,2020-02-11T12:00:00Z,2.5,39.42405,-6.859,Dar es Salaam,Kigamboni,Minazi  Mikinda,Minazi Mikinda,Geza,16,RN,Sphyraena putnamiae,Dermesal,NA,NA,NA,0,NA
11/02/2020,2,NE,2020-02-11T10:00:00Z,2020-02-11T13:00:00Z,3,39.155556,-4.78787,Tanga,Mkinga,Zingibari,Petukiza,Bunju,17,RN,Amblygaster sirm,Anchovy,NA,50,5,16.66666667,16.66666667
12/02/2020,2,NE,2020-02-12T06:20:00Z,2020-02-12T11:25:00Z,5.08,39.25348,-9.13564,Lindi,Lindi,Benki,Beach,Ngo\'mo,17,RN,Auxis rochei,Tuna,NA,105,150,20.65573771,20.66929134
12/02/2020,2,NE,2020-02-12T06:30:00Z,2020-02-12T07:30:00Z,1,40.156678,-10.25136,Mtwara,Mtwara Urban,Shangani East,Feri,Veta,20,RN,Katsuwonus pelamis,Tuna,NA,120,80,120,120
12/02/2020,2,NE,2020-02-12T07:30:00Z,2020-02-12T14:16:00Z,6.77,39.00567,-6.3046,Pwani,Bagamoyo,Mwambao,Kastam(Custom),Mwambakuni,47,RN,Decapterus kurroides,Mackerel,NA,200,10,29.55665024,29.54209749
12/02/2020,2,NE,2020-02-12T08:00:00Z,2020-02-12T12:00:00Z,4,39.57116,-8.3949,Lindi,Kilwa,Somanga,Mbuyuni,Sakaulu,14,RN,Dussumieria acuta,Anchovy,NA,60,5,15,15
12/02/2020,2,NE,2020-02-12T09:00:00Z,2020-02-12T12:30:00Z,3.5,39.15556,-4.78787,Tanga,Mkinga,Zingibari,Petukiza,Bunju,17,RN,Gymnasarda unicolor,Tuna,NA,50,5,14.28571429,14.28571429
12/02/2020,2,NE,2020-02-12T09:34:00Z,2020-02-12T14:00:00Z,4.43,39.12629,-6.38859,Pwani,Bagamoyo,Mwambao,Kastam(Custom),Chumbe,33,RN,Decapterus kurroides,Mackerel,NA,200,10,45.11278196,45.14672686
12/02/2020,2,NE,2020-02-12T10:00:00Z,2020-02-12T12:15:00Z,2.25,39.41084,-6.8529,Dar es Salaam,Kigamboni,Minazi  Mikinda,Minazi Mikinda,Geza,16,RN,Caranx tille,Caranx,NA,160,8,71.11111111,71.11111111
12/02/2020,2,NE,2020-02-12T10:15:00Z,2020-02-12T14:50:00Z,4.58,40.37448,-10.31507,Mtwara,Mtwara Rural,Mnazi,Mnazi Bay,BWANAOGA,21,RN,Dussumieria acuta,Anchovy,NA,640,8,139.6363636,139.7379913
12/02/2020,2,NE,2020-02-12T10:15:00Z,2020-02-12T14:50:00Z,4.58,40.37448,-10.31507,Mtwara,Mtwara Rural,Mnazi,Mnazi Bay,BWANAOGA,21,RN,Dussumieria acuta,Anchovy,NA,640,8,139.6363636,139.7379913
12/02/2020,2,NE,2020-02-12T10:15:00Z,2020-02-12T14:50:00Z,4.58,40.37448,-10.31507,Mtwara,Mtwara Rural,Mnazi,Mnazi Bay,BWANAOGA,21,RN,Dussumieria acuta,Anchovy,NA,640,8,139.6363636,139.7379913
12/02/2020,2,NE,2020-02-12T14:20:00Z,2020-02-12T17:05:00Z,2.75,40.36393,-10.33822,Mtwara,Mtwara Rural,Mnazi,Mnazi Bay,MPETAMA,23,RN,Thunnus obesus,Tuna,NA,112.5,450,40.90909091,40.90909091
13/02/2020,2,NE,2020-02-13T06:20:00Z,2020-02-13T14:04:00Z,7.73,39.2411,-6.66943,Dar es Salaam,Kinondoni,Kunduchi Pwani,Kunduchi Pwani,Mbuji,60,RN,Auxis thazard,Tuna,NA,200,200,25.86206897,25.87322122
13/02/2020,2,NE,2020-02-13T08:45:00Z,2020-02-13T12:10:00Z,3.42,39.12386,-5.09247,Tanga,Mkinga,Zingibari,Petukiza,Mwani,36,RN,Caranx tille,Caranx,NA,10,1.5,2.926829268,2.923976608
13/02/2020,2,NE,2020-02-13T09:15:00Z,2020-02-13T11:15:00Z,2,39.3951,-6.84737,Dar es Salaam,Kigamboni,Minazi  Mikinda,Minazi Mikinda,Kijiweni,15,RN,Caranx tille,Caranx,NA,80,4,40,40
13/02/2020,2,NE,2020-02-13T09:25:00Z,2020-02-13T11:14:00Z,1.82,40.40085,-10.34656,Mtwara,Mtwara Rural,Mnazi,Mnazi Bay,MILAMBA,17,RN,Coryphaena ssp,Tuna,NA,220,22,121.1009174,120.8791209
14/02/2020,2,NE,2020-02-14T00:30:00Z,2020-02-14T05:30:00Z,5,39.12898,-5.08756,Tanga,Tanga City,Sahare,Kasera,Nyamakuu,16,RN,Sardine,Sardines,NA,100,5,20,20
14/02/2020,2,NE,2020-02-14T06:00:00Z,2020-02-14T15:00:00Z,9,39.26024,-6.70257,Dar es Salaam,Kinondoni,Kunduchi Pwani,Kunduchi Pwani,Vipangavinne,40,RN,Sardine,Sardines,NA,160,8,17.77777778,17.77777778
14/02/2020,2,NE,2020-02-14T06:15:00Z,2020-02-14T13:06:00Z,6.85,39.24084,-6.66936,Dar es Salaam,Kinondoni,Kunduchi Pwani,Kunduchi Pwani,Bongoyo,60,RN,Sardine,Sardines,NA,240,12,35.03649635,35.03649635
14/02/2020,2,NE,2020-02-14T06:45:00Z,2020-02-14T14:45:00Z,8,39.24226,-6.68415,Dar es Salaam,Kinondoni,Kunduchi Pwani,Kunduchi Pwani,Panganne,33,RN,Sardine,Sardines,NA,200,10,25,25
14/02/2020,2,NE,2020-02-14T08:05:00Z,2020-02-14T11:21:00Z,3.27,40.88447,-10.34856,Mtwara,Mtwara Rural,Mnazi,Mnazi Bay,MCHATA,15,RN,Coryphaena ssp,Tuna,NA,NA,NA,0,NA
14/02/2020,2,NE,2020-02-14T08:05:00Z,2020-02-14T11:21:00Z,3.27,40.38447,-10.34856,Mtwara,Mtwara Rural,Mnazi,Mnazi Bay,MCHATA,15,RN,Coryphaena ssp,Tuna,NA,NA,NA,0,NA
14/02/2020,2,NE,2020-02-14T08:05:00Z,2020-02-14T11:21:00Z,3.27,40.88447,-10.34856,Mtwara,Mtwara Rural,Mnazi,Mnazi Bay,MCHATA,15,RN,Coryphaena ssp,Tuna,NA,NA,NA,0,NA
14/02/2020,2,NE,2020-02-14T10:10:00Z,2020-02-14T12:00:00Z,1.83,40.32671,-10.35347,Mtwara,Mtwara Rural,Mnazi,Mnazi Bay,KIWALE,20,RN,Dussumieria acuta,Anchovy,NA,NA,NA,0,NA
14/02/2020,2,NE,2020-02-14T10:10:00Z,2020-02-14T12:00:00Z,1.83,40.32671,-10.35347,Mtwara,Mtwara Rural,Mnazi,Mnazi Bay,KIWALE,20,RN,Dussumieria acuta,Anchovy,NA,NA,NA,0,NA
15/02/2020,2,NE,2020-02-15T05:00:00Z,2020-02-15T09:00:00Z,4,39.15546,-5.15546,Tanga,Mkinga,Zingibari,Petukiza,Bunju,16,RN,Auxis thazard,Tuna,NA,20,3,5,5
15/02/2020,2,NE,2020-02-15T05:30:00Z,2020-02-15T05:30:00Z,0,39.94337,-9.64691,Lindi,Lindi,Benki,Beach,Ruvu,6,TL,Gymnasarda unicolor,Tuna,NA,150,3,Inf,Inf
15/02/2020,2,NE,2020-02-15T07:00:00Z,2020-02-15T08:00:00Z,1,39.30487,-8.30487,Lindi,Kilwa,Somanga,Mbuyuni,Selemani,14,RN,Rastrelliger kanagurta,Mackerel,NA,72,6,72,72
15/02/2020,2,NE,2020-02-15T10:10:00Z,2020-02-15T12:00:00Z,1.83,40.32671,-10.35347,Mtwara,Mtwara Rural,Mnazi,Mnazi Bay,KIWALE,20,RN,Dussumieria acuta,Anchovy,NA,NA,NA,0,NA
15/02/2020,2,NE,2020-02-15T12:35:00Z,2020-02-15T18:10:00Z,5.58,39.50028,-9.35764,Lindi,Lindi,Benki,Beach,Kiramba,26,RN,Auxis rochei,Tuna,NA,312,450,55.88059702,55.91397849
15/02/2020,2,NE,2020-02-15T21:00:00Z,2020-02-16T07:30:00Z,10.5,39.05988,-5.5075,Tanga,Pangani,Pangani Mashariki,Magarawani,Dacha,22,RN,Stolephorus devisi,Anchovy,NA,1040,52,99.04761905,99.04761905
15/02/2020,2,NE,2020-02-15T21:30:00Z,2020-02-16T05:00:00Z,7.5,39.12926,-5.0876,Tanga,Tanga City,Sahare,Kasera,Kiboya chekundu,17,RN,Sardine,Sardines,NA,40,2,5.333333333,5.333333333
15/02/2020,2,NE,2020-02-15T22:00:00Z,2020-02-16T05:45:00Z,7.75,39.07753,-5.05251,Tanga,Tanga City,Sahare,Kasera,Mwambani,12,RN,Gazza minuta,Dermesal,NA,60,3,7.741935484,7.741935484
16/02/2020,2,NE,2020-02-16T06:00:00Z,2020-02-16T15:00:00Z,9,39.28662,-8.39099,Lindi,Kilwa,Somanga,Mbuyuni,Mkondoni,12,RN,Sardine,Sardines,NA,20,1,2.222222222,2.222222222
16/02/2020,2,NE,2020-02-16T08:45:00Z,2020-02-16T14:30:00Z,5.75,39.34244,-6.76193,Dar es Salaam,Kigamboni,Minazi  Mikinda,Minazi Mikinda,Katumbi,15,RN,Sphyraena barracuda,Dermesal,NA,NA,NA,0,NA
16/02/2020,2,NE,2020-02-16T08:50:00Z,2020-02-16T10:30:00Z,1.67,40.33271,-10.34175,Mtwara,Mtwara Rural,Mnazi,Mnazi Bay,CHUMBU,14,RN,Sardine,Sardines,NA,80,2,47.99999999,47.90419162
16/02/2020,2,NE,2020-02-16T13:00:00Z,2020-02-16T17:00:00Z,4,39.165199,-4.7788,Tanga,Mkinga,Zingibari,Petukiza,Mwezi,18,RN,Dussumieria acuta,Anchovy,NA,100,10,25,25
16/02/2020,2,NE,2020-02-16T18:30:00Z,2020-02-17T05:00:00Z,10.5,39.0676,-5.05419,Tanga,Tanga City,Sahare,Kasera,Funga Milango,13,RN,Stolephorus commersonii,Anchovy,NA,20,1,1.904761905,1.904761905
16/02/2020,2,NE,2020-02-16T18:40:00Z,2020-02-17T05:15:00Z,10.58,39.64925,-7.90518,Pwani,Mafia,Kilindoni,Kilindoni,Mob,18,RN,Dussumieria acuta,Anchovy,NA,60,20,5.66929134,5.671077505
16/02/2020,2,NE,2020-02-16T19:00:00Z,2020-02-17T05:45:00Z,10.75,39.2631,-6.5631,Dar es Salaam,Kigamboni,Minazi  Mikinda,Minazi Mikinda,Sinda,25,RN,Stolephorus devisi,Anchovy,NA,100,5,9.302325581,9.302325581
16/02/2020,2,NE,2020-02-16T19:15:00Z,2020-02-17T01:15:00Z,6,39.09322,-5.43285,Tanga,Pangani,Kipumbwi,Kipumbwi,Sange,22,RN,Sardine,Sardines,NA,140,7,23.33333333,23.33333333
16/02/2020,2,NE,2020-02-16T22:33:00Z,2020-02-17T04:01:00Z,5.47,39.0682,-5.5499,Unguja,Kaskazini A,Mkokotoni,Nungwi,Maziwe,17,GN,Dussumieria acuta,Anchovy,NA,520,26,95.12195121,95.06398537
16/02/2020,2,NE,2020-02-16T22:40:00Z,2020-02-17T09:30:00Z,10.83,39.15809,-4.78475,Tanga,Mkinga,Zingibari,Petukiza,Mbayài,23,RN,Scomberomorus plurilineatus,Tuna,NA,16,3,1.476923077,1.477377655
16/02/2020,2,NE,2020-02-16T23:00:00Z,2020-02-17T04:05:00Z,5.08,39.07704,-5.4296,Tanga,Pangani,Pangani Mashariki,Magarawani,Kinaran,22,RN,Sardine,Sardines,NA,300,15,59.01639345,59.05511811
16/02/2020,2,NE,2020-02-16T23:00:00Z,2020-02-17T05:00:00Z,6,39.28674,-8.39087,Lindi,Kilwa,Somanga,Mbuyuni,Mibuyuni,12,RN,Sardine,Sardines,NA,840,70,140,140
17/02/2020,2,NE,2020-02-17T00:00:00Z,2020-02-17T06:00:00Z,6,39.28674,-8.39087,Lindi,Kilwa,Somanga,Mbuyuni,Fungu mbili,11,RN,Sardine,Sardines,NA,380,19,63.33333333,63.33333333
17/02/2020,2,NE,2020-02-17T06:00:00Z,2020-02-17T17:00:00Z,11,39.28662,-8.39099,Lindi,Kilwa,Somanga,Mbuyuni,Mubuyuni,14,RN,Sardine,Sardines,NA,12,1,1.090909091,1.090909091
17/02/2020,2,NE,2020-02-17T09:00:00Z,2020-02-17T11:00:00Z,2,40.3266,-10.35313,Mtwara,Mtwara Rural,Mnazi,Mnazi Bay,CHUMBU,20,RN,Coryphaena ssp,Tuna,NA,120,6,60,60
17/02/2020,2,NE,2020-02-17T19:00:00Z,2020-02-18T06:00:00Z,11,39.25562,-6.70072,Dar es Salaam,Kigamboni,Minazi  Mikinda,Minazi Mikinda,Bongoyo,25,RN,Sardine,Sardines,NA,100,5,9.090909091,9.090909091
17/02/2020,2,NE,2020-02-17T19:41:00Z,2020-02-18T03:40:00Z,7.98,39.05909,-5.49359,Unguja,Kaskazini A,Mkokotoni,Nungwi,Pangani,17,GN,Dussumieria acuta,Anchovy,NA,700,35,87.68267224,87.71929825
17/02/2020,2,NE,2020-02-17T20:00:00Z,2020-02-18T05:00:00Z,9,39.12924,-5.0876,Tanga,Tanga City,Sahare,Kasera,Jambe rasini,16,RN,Dussumieria acuta,Anchovy,NA,80,4,8.888888889,8.888888889
17/02/2020,2,NE,2020-02-17T22:30:00Z,2020-02-18T03:01:00Z,4.52,39.05988,-5.5075,Tanga,Pangani,Pangani Mashariki,Magarawani,Dachi,24,RN,Sardine,Sardines,NA,40,2,8.85608856,8.849557522
18/02/2020,2,NE,2020-02-18T00:00:00Z,2020-02-18T04:30:00Z,4.5,39.06206,-5.58608,Tanga,Pangani,Pangani Mashariki,Magarawani,Zinga,24,RN,Sardine,Sardines,NA,400,20,88.88888889,88.88888889
18/02/2020,2,NE,2020-02-18T06:20:00Z,2020-02-18T10:15:00Z,3.92,40.15669,-10.24399,Mtwara,Mtwara Urban,Kiyanga,Uyavi,Mwantuona,17,RN,Auxis rochei,Tuna,NA,140,150,35.74468085,35.71428571
18/02/2020,2,NE,2020-02-18T07:30:00Z,2020-02-18T11:10:00Z,3.67,39.81593,-9.89788,Lindi,Lindi,Benki,Beach,Mitwero,5,TL,Gymnasarda unicolor,Tuna,NA,200,10,54.54545454,54.49591281
18/02/2020,2,NE,2020-02-18T08:00:00Z,2020-02-18T11:30:00Z,3.5,39.16042,-4.77908,Tanga,Mkinga,Zingibari,Petukiza,Mwezi,15,RN,Sphyraena putnamiae,Dermesal,NA,40,4,11.42857143,11.42857143
18/02/2020,2,NE,2020-02-18T09:30:00Z,2020-02-18T11:20:00Z,1.83,40.32661,-10.35313,Mtwara,Mtwara Rural,Mnazi,Mnazi Bay,LIZIWIYO,20,RN,Coryphaena ssp,Tuna,NA,60,3,32.72727273,32.78688525
18/02/2020,2,NE,2020-02-18T10:00:00Z,2020-02-18T12:00:00Z,2,39.1798,-5.06309,Tanga,Tanga City,Halmashauri,Deep Sea,Nyuli,50,RN,Euthynnus affinis,Tuna,NA,300,200,150,150
18/02/2020,2,NE,2020-02-18T14:00:00Z,2020-02-18T18:20:00Z,4.33,39.615556,-4.78787,Tanga,Mkinga,Zingibari,Petukiza,Chundosw,16,RN,Dussumieria acuta,Anchovy,NA,100,10,23.07692308,23.09468822
18/02/2020,2,NE,2020-02-18T17:30:00Z,2020-02-19T05:30:00Z,12,39.23062,-4.81725,Tanga,Mkinga,Zingibari,Petukiza,Mbayai,25,RN,Dussumieria acuta,Anchovy,NA,160,4,13.33333333,13.33333333
18/02/2020,2,NE,2020-02-18T19:13:00Z,2020-02-19T05:00:00Z,9.78,39.66656,-7.84393,Pwani,Mafia,Chunguruma,Tumbuju,Kichevi,14,RN,Dagaa,Anchovy,Dagaa mchele,600,30,61.34969325,61.34969325
18/02/2020,2,NE,2020-02-18T19:15:00Z,2020-02-18T20:45:00Z,1.5,38.93423,-5.94654,Unguja,Kaskazini A,Mkokotoni,Nungwi,Kipumbwi,16,GN,Dussumieria acuta,Anchovy,NA,700,35,466.6666667,466.6666667
18/02/2020,2,NE,2020-02-18T20:00:00Z,2020-02-19T02:45:00Z,6.75,39.26943,-6.71661,Dar es Salaam,Kinondoni,Kunduchi Pwani,Kunduchi Pwani,Chumbe,60,RN,Euthynnus affinis,Tuna,NA,59,59,8.740740741,8.740740741
18/02/2020,2,NE,2020-02-18T20:47:00Z,2020-02-19T03:15:00Z,6.47,39.64545,-7.71882,Pwani,Mafia,Kilindoni,Kilindoni,Mboji,20,RN,Sardine,Sardines,NA,280,20,43.29896907,43.27666151
18/02/2020,2,NE,2020-02-18T21:40:00Z,2020-02-19T05:00:00Z,7.33,39.12899,-5.08754,Tanga,Tanga City,Sahare,Kasera,Jambe rasini,16,RN,Dussumieria acuta,Anchovy,NA,40,2,5.454545455,5.457025921
19/02/2020,2,NE,2020-02-19T00:00:00Z,2020-02-19T05:00:00Z,5,39.25991,-4.8676,Tanga,Mkinga,Zingibari,Petukiza,Kwamzungu,24,RN,Sardine,Sardines,NA,200,10,40,40
19/02/2020,2,NE,2020-02-19T00:30:00Z,2020-02-19T04:00:00Z,3.5,39.07256,-5.39857,Tanga,Pangani,Pangani Mashariki,Magarawani,Kigombe,24,RN,Sardine,Sardines,NA,400,20,114.2857143,114.2857143
19/02/2020,2,NE,2020-02-19T01:00:00Z,2020-02-19T04:30:00Z,3.5,39.15818,-4.78478,Tanga,Mkinga,Zingibari,Petukiza,Chundo,23,RN,Sardine,Sardines,NA,200,10,57.14285714,57.14285714
19/02/2020,2,NE,2020-02-19T05:00:00Z,2020-02-19T07:00:00Z,2,39.25573,-6.69918,Dar es Salaam,Kinondoni,Kunduchi Pwani,Kunduchi Pwani,Pungume,49,RN,Sardine,Sardines,NA,600,60,300,300
19/02/2020,2,NE,2020-02-19T06:00:00Z,2020-02-19T09:00:00Z,3,39.37731,-6.03909,Dar es Salaam,Kinondoni,Kunduchi Pwani,Kunduchi Pwani,Mkaji,33,RN,Sardine,Sardines,NA,800,40,266.6666667,266.6666667
19/02/2020,2,NE,2020-02-19T06:30:00Z,2020-02-19T11:30:00Z,5,39.94337,-9.64691,Lindi,Lindi,Benki,Beach,Ruvu,16,RN,Thunnus tonggol,Tuna,NA,NA,150,0,NA
19/02/2020,2,NE,2020-02-19T07:00:00Z,2020-02-19T12:40:00Z,5.67,39.71792,-10.00252,Lindi,Lindi,Benki,Beach,Mwitingi,16,RN,Chirocentrus dorab,Dermesal,NA,30,13,5.294117647,5.291005291
19/02/2020,2,NE,2020-02-19T07:30:00Z,2020-02-19T10:45:00Z,3.25,39.9664,-9.65819,Lindi,Lindi,Benki,Beach,Nondo,5,TL,Gymnasarda unicolor,Tuna,NA,250,4,76.92307692,76.92307692
19/02/2020,2,NE,2020-02-19T12:30:00Z,2020-02-19T16:00:00Z,3.5,39.05992,-5.58028,Tanga,Pangani,Pangani Mashariki,Magarawani,Zinga,24,RN,Sardine,Sardines,NA,100,5,28.57142857,28.57142857
19/02/2020,2,NE,2020-02-19T16:00:00Z,2020-02-19T19:00:00Z,3,39.3278,-6.47967,Dar es Salaam,Kinondoni,Kunduchi Pwani,Kunduchi Pwani,Kobella,49,RN,Euthynnus affinis,Tuna,NA,140,14,46.66666667,46.66666667
19/02/2020,2,NE,2020-02-19T19:00:00Z,2020-02-20T06:01:00Z,11.02,39.17,-5.28,Tanga,Muheza,Kigombe,Kigombe,Majivike,15,RN,Sardine,Sardines,NA,1000,50,90.77155822,90.74410163
19/02/2020,2,NE,2020-02-19T19:00:00Z,2020-02-20T05:30:00Z,10.5,39.17,-5.2,Tanga,Muheza,Kigombe,Kigombe,Funguni,18,RN,Sardine,Sardines,NA,100,5,9.523809524,9.523809524
19/02/2020,2,NE,2020-02-19T19:00:00Z,2020-02-20T06:00:00Z,11,39.35252,-6.794995,Dar es Salaam,Kigamboni,Minazi  Mikinda,Minazi Mikinda,Katumbi,25,RN,Sardine,Sardines,NA,600,30,54.54545455,54.54545455
19/02/2020,2,NE,2020-02-19T19:10:00Z,2020-02-20T06:00:00Z,10.83,39.06244,-5.38636,Tanga,Muheza,Kigombe,Kigombe,Mwamuunguja,18,RN,Sardine,Sardines,NA,100,5,9.230769234,9.233610342
19/02/2020,2,NE,2020-02-19T19:14:00Z,2020-02-20T06:51:00Z,11.62,39.06244,-5.38636,Tanga,Muheza,Kigombe,Kigombe,Mwanaunguja,18,RN,Sardine,Sardines,NA,100,5,8.608321375,8.605851979
19/02/2020,2,NE,2020-02-19T19:30:00Z,2020-02-20T06:30:00Z,11,39.61161,-5.30856,Pemba,Pemba Kusini,Mbuyuni,Ngazini,Mtipe,22,RN,Sardine,Sardines,NA,400,20,36.36363636,36.36363636
19/02/2020,2,NE,2020-02-19T20:00:00Z,2020-02-20T07:00:00Z,11,39.43612,-8.4131,Lindi,Kilwa,Somanga,Mbuyuni,Mbuyuni,14,RN,Rastrelliger kanagurta,Mackerel,NA,96,8,8.727272727,8.727272727
19/02/2020,2,NE,2020-02-19T20:00:00Z,2020-02-20T01:00:00Z,5,39.43612,-8.41301,Lindi,Kilwa,Somanga,Mbuyuni,Fungu kubwa,14,RN,Rastrelliger kanagurta,Mackerel,NA,96,8,19.2,19.2
19/02/2020,2,NE,2020-02-19T20:00:00Z,2020-02-20T04:30:00Z,8.5,39.60604,-5.31281,Pemba,Pemba Kusini,Mbuyuni,Ngazini,Mtipe,25,RN,Sardine,Sardines,NA,280,14,32.94117647,32.94117647
19/02/2020,2,NE,2020-02-19T21:30:00Z,2020-02-20T05:45:00Z,8.25,39.12899,-5.08756,Tanga,Tanga City,Sahare,Kasera,Ulenge,16,RN,Sardine,Sardines,NA,280,14,33.93939394,33.93939394
19/02/2020,2,NE,2020-02-19T22:22:00Z,2020-02-20T03:15:00Z,4.88,39.07205,-5.414587,Tanga,Pangani,Pangani Mashariki,Magarawani,Mwamba mawe,22,RN,Sardine,Sardines,NA,40,2,8.19112628,8.196721311
20/02/2020,2,NE,2020-02-20T07:00:00Z,2020-02-20T12:00:00Z,5,39.21765,-4.93958,Tanga,Tanga City,Halmashauri,Deep Sea,Wamba,55,RN,Auxis rochei,Tuna,NA,780,600,156,156
20/02/2020,2,NE,2020-02-20T07:00:00Z,2020-02-20T12:20:00Z,5.33,40.19561,-10.22849,Mtwara,Mtwara Urban,Shangani East,Feri,Naumbu,21,RN,Auxis thazard,Tuna,NA,NA,NA,0,NA
20/02/2020,2,NE,2020-02-20T07:00:00Z,2020-02-20T11:00:00Z,4,39.2643,-4.85872,Tanga,Mkinga,Zingibari,Petukiza,Kwamzungu,22,RN,Sardine,Sardines,NA,500,25,125,125
20/02/2020,2,NE,2020-02-20T07:00:00Z,2020-02-20T09:00:00Z,2,39.11664,-6.3701,Dar es Salaam,Kinondoni,Kunduchi Pwani,Kunduchi Pwani,Mkaji,40,RN,Selar crumenophthalmus,Caranx,NA,800,40,400,400
20/02/2020,2,NE,2020-02-20T07:29:00Z,2020-02-20T11:15:00Z,3.77,39.749878,-9.974122,Lindi,Lindi,Benki,Beach,Mwitingi,17,RN,Sardine,Sardines,NA,90,9,23.89380531,23.87267905
20/02/2020,2,NE,2020-02-20T07:30:00Z,2020-02-20T11:00:00Z,3.5,39.25367,-8.14438,Lindi,Kilwa,Somanga,Mbuyuni,Koroba,14,RN,Decapterus russelli,Mackerel,NA,12,1,3.428571429,3.428571429
20/02/2020,2,NE,2020-02-20T09:35:00Z,2020-02-20T14:15:00Z,4.67,39.28662,-8.39099,Lindi,Kilwa,Somanga,Mbuyuni,Mchange,11,RN,Sardine,Sardines,NA,250,5,53.57142857,53.53319058
20/02/2020,2,NE,2020-02-20T12:10:00Z,2020-02-20T16:20:00Z,4.17,39.25801,-4.87009,Tanga,Mkinga,Zingibari,Petukiza,Chundo,21,RN,Sardine,Sardines,NA,500,25,120,119.9040767
20/02/2020,2,NE,2020-02-20T18:00:00Z,2020-02-21T06:00:00Z,12,39.28699,-8.39112,Lindi,Kilwa,Somanga,Mbuyuni,Fungu mbili,12,RN,Sardine,Sardines,NA,120,6,10,10
20/02/2020,2,NE,2020-02-20T18:30:00Z,2020-02-21T06:00:00Z,11.5,39.10137,-5.01991,Tanga,Tanga City,Sahare,Kasera,Kwasoka,12,RN,Sardine,Sardines,NA,600,30,52.17391304,52.17391304
20/02/2020,2,NE,2020-02-20T19:10:00Z,2020-02-21T00:30:00Z,5.33,39.68926,-7.80837,Pwani,Mafia,Kilindoni,Kilindoni,Rasini,20,RN,Sardine,Sardines,NA,400,20,75,75.04690432
20/02/2020,2,NE,2020-02-20T19:41:00Z,2020-02-20T23:41:00Z,4,38.9618,-5.9618,Unguja,Kaskazini A,Mkokotoni,Nungwi,Mkokotoni,23,GN,Encrasicholina heteroloba,Anchovy,NA,100,5,25,25
20/02/2020,2,NE,2020-02-20T19:41:00Z,2020-02-20T23:41:00Z,4,38.9618,-5.9618,Unguja,Kaskazini A,Mkokotoni,Nungwi,Mkokotoni,23,GN,Mackerel(scomber),Mackerel,NA,40,2,10,10
20/02/2020,2,NE,2020-02-20T20:30:00Z,2020-02-21T05:30:00Z,9,39.12926,-5.0876,Tanga,Tanga City,Sahare,Kasera,Kaulenge,16,RN,Sardine,Sardines,NA,240,12,26.66666667,26.66666667
20/02/2020,2,NE,2020-02-20T21:57:00Z,2020-02-21T04:58:00Z,7.02,39.04143,-6.17495,Unguja,Kaskazini A,Mkokotoni,Nungwi,Fungurefu NGONYAN,18,GN,Mackerel(scomber),Mackerel,NA,260,13,37.05463183,37.03703704
20/02/2020,2,NE,2020-02-20T22:50:00Z,2020-02-21T04:50:00Z,6,39.05959,-5.5692,Tanga,Pangani,Pangani Mashariki,Magarawani,Dachi,22,RN,Sardine,Sardines,NA,400,20,66.66666667,66.66666667
21/02/2020,2,NE,2020-02-21T02:00:00Z,2020-02-21T05:30:00Z,3.5,39.12893,-5.08759,Tanga,Tanga City,Sahare,Kasera,Kaulenge,16,RN,Sardine,Sardines,NA,800,40,228.5714286,228.5714286
21/02/2020,2,NE,2020-02-21T02:10:00Z,2020-02-21T04:30:00Z,2.33,39.67576,-7.7624,Pwani,Mafia,Chunguruma,Tumbuju,Katikati,18,RN,Dagaa,Anchovy,Dagaa mchele,800,40,343.3476395,343.3476395
21/02/2020,2,NE,2020-02-21T06:30:00Z,2020-02-21T13:19:00Z,6.82,40.38447,-10.34856,Mtwara,Mtwara Urban,Shangani East,Feri,Veta,22,RN,Auxis thazard,Tuna,NA,50,56,7.334963325,7.331378299
21/02/2020,2,NE,2020-02-21T08:00:00Z,2020-02-21T12:20:00Z,4.33,39.7448,-9.97686,Lindi,Lindi,Benki,Beach,Mwitingi,18,RN,Sardine,Sardines,NA,200,20,46.15384616,46.18937644
21/02/2020,2,NE,2020-02-21T08:10:00Z,2020-02-21T10:30:00Z,2.33,40.3392,-10.33543,Mtwara,Mtwara Rural,Mnazi,Mnazi Bay,HALFANI,11,RN,Encrasicholina heteroloba,Anchovy,NA,640,4,274.2857143,274.6781116
21/02/2020,2,NE,2020-02-21T19:16:00Z,2020-02-22T04:17:00Z,9.02,38.95176,-5.9618,Unguja,Kaskazini A,Mkokotoni,Nungwi,MELIN,23,GN,Encrasicholina heteroloba,Anchovy,NA,400,20,44.36229205,44.345898
21/02/2020,2,NE,2020-02-21T19:16:00Z,2020-02-22T04:17:00Z,9.02,38.95176,-5.9618,Unguja,Kaskazini A,Mkokotoni,Nungwi,MELIN,23,GN,Mackerel(scomber),Mackerel,NA,160,8,17.74491682,17.7383592
21/02/2020,2,NE,2020-02-21T19:42:00Z,2020-02-22T05:05:00Z,9.38,39.226049,-4.87747,Tanga,Mkinga,Zingibari,Petukiza,Bunju,21,RN,Sardine,Sardines,NA,100,5,10.65719361,10.66098081
21/02/2020,2,NE,2020-02-21T20:15:00Z,2020-02-22T05:00:00Z,8.75,39.09459,-5.0542,Tanga,Tanga City,Sahare,Kasera,Jambe,16,RN,Sardine,Sardines,NA,140,7,16,16
21/02/2020,2,NE,2020-02-21T20:30:00Z,2020-02-22T06:00:00Z,9.5,39.0302,-5.53961,Tanga,Pangani,Pangani Mashariki,Magarawani,Mto wa zinga,24,RN,Sardine,Sardines,NA,200,10,21.05263158,21.05263158
21/02/2020,2,NE,2020-02-21T21:30:00Z,2020-02-22T04:00:00Z,6.5,39.26892,-6.56379,Dar es Salaam,Kinondoni,Kunduchi Pwani,Kunduchi Pwani,Chumbe,60,RN,Euthynnus affinis,Tuna,NA,240,24,36.92307692,36.92307692
21/02/2020,2,NE,2020-02-21T21:52:00Z,2020-02-22T04:29:00Z,6.62,39.0143,-5.77445,Unguja,Kaskazini A,Mkokotoni,Nungwi,FUNGUREFU NGONYAN,17,GN,Dussumieria acuta,Anchovy,NA,200,10,30.22670025,30.21148036
21/02/2020,2,NE,2020-02-21T22:40:00Z,2020-02-22T05:42:00Z,7.03,39.26319,-4.8556,Tanga,Mkinga,Zingibari,Petukiza,Kwamzungu,22,RN,Sardine,Sardines,NA,600,30,85.30805688,85.3485064
21/02/2020,2,NE,2020-02-21T23:30:00Z,2020-02-22T03:00:00Z,3.5,39.20277,-6.39575,Dar es Salaam,Kinondoni,Kunduchi Pwani,Kunduchi Pwani,Chumbe,22,RN,Sardine,Sardines,NA,800,40,228.5714286,228.5714286
21/02/2020,2,NE,2020-02-21T23:35:00Z,2020-02-22T05:30:00Z,5.92,39.05647,-5.69004,Tanga,Pangani,Pangani Mashariki,Magarawani,Mijimile,22,RN,Sardine,Sardines,NA,80,4,13.52112676,13.51351351
22/02/2020,2,NE,2020-02-22T00:15:00Z,2020-02-22T05:00:00Z,4.75,39.01045,-5.56244,Tanga,Pangani,Pangani Mashariki,Magarawani,Zinga,22,RN,Sardine,Sardines,NA,200,10,42.10526316,42.10526316
22/02/2020,2,NE,2020-02-22T00:30:00Z,2020-02-22T05:30:00Z,5,39.0209,-5.32252,Tanga,Pangani,Pangani Mashariki,Magarawani,Zinga,24,RN,Sardine,Sardines,NA,600,30,120,120
22/02/2020,2,NE,2020-02-22T01:30:00Z,2020-02-22T06:00:00Z,4.5,39.16037,-4.77909,Tanga,Mkinga,Zingibari,Petukiza,Mwezi,17,RN,Auxis thazard,Tuna,NA,10,5,2.222222222,2.222222222
22/02/2020,2,NE,2020-02-22T06:00:00Z,2020-02-22T12:45:00Z,6.75,39.26892,-6.56379,Dar es Salaam,Kinondoni,Kunduchi Pwani,Kunduchi Pwani,Panganne,51,RN,Sardine,Sardines,NA,240,24,35.55555556,35.55555556
22/02/2020,2,NE,2020-02-22T06:20:00Z,2020-02-22T10:30:00Z,4.17,40.38447,-10.34856,Mtwara,Mtwara Urban,Kiyanga,Uyavi,Mkungu,20,RN,Auxis rochei,Tuna,NA,52,104,12.48,12.47002398
22/02/2020,2,NE,2020-02-22T06:30:00Z,2020-02-22T11:40:00Z,5.17,40.32671,-10.35347,Mtwara,Mtwara Urban,Shangani East,Feri,Samwange,25,RN,Auxis thazard,Tuna,NA,162,180,31.35483871,31.33462282
22/02/2020,2,NE,2020-02-22T08:00:00Z,2020-02-22T11:00:00Z,3,39.26683,-4.86935,Tanga,Mkinga,Zingibari,Petukiza,Kwamzumgu,21,RN,Amblygaster sirm,Anchovy,NA,120,6,40,40
22/02/2020,2,NE,2020-02-22T08:05:00Z,2020-02-22T10:13:00Z,2.13,40.3574,-10.33228,Mtwara,Mtwara Rural,Mnazi,Mnazi Bay,KIPWA KIKUBWA,14,RN,Coryphaena ssp,Tuna,NA,400,20,187.5,187.7934272
22/02/2020,2,NE,2020-02-22T08:15:00Z,2020-02-22T11:15:00Z,3,39.74852,-9.897517,Lindi,Lindi,Benki,Beach,Mwitingi,18,RN,Sardine,Sardines,NA,260,26,86.66666667,86.66666667
22/02/2020,2,NE,2020-02-22T08:48:00Z,2020-02-22T12:17:00Z,3.48,39.15817,-4.78464,Tanga,Mkinga,Zingibari,Petukiza,Fazili,21,RN,Sardine,Sardines,NA,400,20,114.8325359,114.9425287
22/02/2020,2,NE,2020-02-22T09:30:00Z,2020-02-22T12:00:00Z,2.5,40.39243,-10.27424,Mtwara,Mtwara Rural,Mnazi,Mnazi Bay,CHELO,21,RN,Coryphaena ssp,Tuna,NA,10,1,4,4
22/02/2020,2,NE,2020-02-22T18:32:00Z,2020-02-23T05:32:00Z,11,39.65139,-7.73504,Pwani,Mafia,Chunguruma,Tumbuju,Masemeni,13,RN,Dagaa,Anchovy,Dagaa mchele,60,3,5.454545455,5.454545455
22/02/2020,2,NE,2020-02-22T19:30:00Z,2020-02-23T04:02:00Z,8.53,38.95176,-5.9618,Unguja,Kaskazini A,Mkokotoni,Nungwi,MELIN,21,GN,Dussumieria acuta,Anchovy,NA,600,30,70.3125,70.33997655
22/02/2020,2,NE,2020-02-22T21:00:00Z,2020-02-23T06:00:00Z,9,39.16037,-4.77909,Tanga,Mkinga,Zingibari,Petukiza,Mwezi,15,RN,Scomberomorus plurilineatus,Tuna,NA,100,NA,11.11111111,11.11111111
22/02/2020,2,NE,2020-02-22T23:00:00Z,2020-02-23T05:00:00Z,6,39.43369,-8.41439,Lindi,Kilwa,Somanga,Mbuyuni,Machange,13,RN,Sardine,Sardines,NA,144,8,24,24
23/02/2020,2,NE,2020-02-23T00:15:00Z,2020-02-23T05:30:00Z,5.25,39.03612,-5.54535,Tanga,Pangani,Pangani Mashariki,Magarawani,Zinga,22,RN,Sardine,Sardines,NA,300,15,57.14285714,57.14285714
23/02/2020,2,NE,2020-02-23T01:30:00Z,2020-02-23T06:00:00Z,4.5,39.16037,-4.77909,Tanga,Mkinga,Zingibari,Petukiza,Mwez,17,RN,Auxis thazard,Tuna,NA,10,5,2.222222222,2.222222222
23/02/2020,2,NE,2020-02-23T06:00:00Z,2020-02-23T06:45:00Z,0.75,39.23549,-6.67928,Dar es Salaam,Kinondoni,Kunduchi Pwani,Kunduchi Pwani,Bongoyo,42,RN,Sardine,Sardines,NA,100,10,133.3333333,133.3333333
23/02/2020,2,NE,2020-02-23T06:40:00Z,2020-02-23T09:40:00Z,3,40.40085,-10.34656,Mtwara,Mtwara Urban,Shangani East,Feri,Msemo Merenium,20,RN,Auxis thazard,Tuna,NA,NA,NA,0,NA
23/02/2020,2,NE,2020-02-23T09:05:00Z,2020-02-23T11:02:00Z,1.95,40.37448,-10.31507,Mtwara,Mtwara Rural,Mnazi,Mnazi Bay,KITELELA,16,RN,Dussumieria acuta,Anchovy,NA,120,12,61.53846154,61.53846154
23/02/2020,2,NE,2020-02-23T11:00:00Z,2020-02-23T12:27:00Z,1.45,40.36393,-10.33822,Mtwara,Mtwara Rural,Mnazi,Mnazi Bay,"NANDISI",20,RN,Caranx tille,Caranx,NA,NA,NA,0,NA
23/02/2020,2,NE,2020-02-23T18:00:00Z,2020-02-24T02:00:00Z,8,39.22711,-4.73673,Tanga,Mkinga,Zingibari,Petukiza,K wamzungu,22,RN,Sardine,Sardines,NA,60,3,7.5,7.5
23/02/2020,2,NE,2020-02-23T19:29:00Z,2020-02-24T06:05:00Z,10.6,39.0942,-5.36518,Tanga,Muheza,Kigombe,Kigombe,Mwanaunguja,18,RN,Sardine,Sardines,NA,100,5,9.433962264,9.433962264
23/02/2020,2,NE,2020-02-23T19:45:00Z,2020-02-24T06:05:00Z,10.33,39.0942,-5.36518,Tanga,Muheza,Kigombe,Kigombe,Majivike,18,RN,Sardine,Sardines,NA,100,5,9.677419358,9.68054211
23/02/2020,2,NE,2020-02-23T20:00:00Z,2020-02-24T05:30:00Z,9.5,39.12895,-5.08757,Tanga,Tanga City,Sahare,Kasera,Ulenge,16,RN,Sardine,Sardines,NA,160,8,16.84210526,16.84210526
23/02/2020,2,NE,2020-02-23T21:00:00Z,2020-02-24T05:30:00Z,8.5,39.02178,-5.54214,Tanga,Pangani,Pangani Mashariki,Magarawani,Mwera zinga,24,RN,Sardine,Sardines,NA,200,10,23.52941176,23.52941176
23/02/2020,2,NE,2020-02-23T21:05:00Z,2020-02-24T05:12:00Z,8.12,39.15816,-4.78459,Tanga,Mkinga,Zingibari,Petukiza,Kiroba,21,RN,Stolephorus commersonii,Anchovy,NA,300,3,36.96098562,36.94581281
23/02/2020,2,NE,2020-02-23T23:30:00Z,2020-02-24T05:00:00Z,5.5,39.43497,-8.41361,Lindi,Kilwa,Somanga,Mbuyuni,Machange,13,RN,Sardine,Sardines,NA,198,11,36,36
24/02/2020,2,NE,2020-02-24T05:00:00Z,2020-02-24T08:00:00Z,3,39.12386,-5.09247,Tanga,Mkinga,Zingibari,Petukiza,Funguni,34,RN,Rastrelliger kanagurta,Mackerel,NA,4,100,1.333333333,1.333333333
24/02/2020,2,NE,2020-02-24T06:30:00Z,2020-02-24T10:20:00Z,3.83,40.38447,-10.34856,Mtwara,Mtwara Urban,Shangani East,Feri,Kivale juu,18,RN,Auxis rochei,Tuna,NA,153,128,39.91304348,39.94778068
24/02/2020,2,NE,2020-02-24T08:00:00Z,2020-02-24T11:00:00Z,3,39.22711,-4.73673,Tanga,Mkinga,Zingibari,Petukiza,Kishangan,22,RN,Mackerel(scomber),Mackerel,NA,40,2,13.33333333,13.33333333
24/02/2020,2,NE,2020-02-24T08:31:00Z,2020-02-24T13:28:00Z,4.95,40.37448,-10.31507,Mtwara,Mtwara Rural,Mnazi,Mnazi Bay,MSILO NDOGO,19,RN,Sphyraena barracuda,Dermesal,NA,80,8,16.16161616,16.16161616
24/02/2020,2,NE,2020-02-24T10:30:00Z,2020-02-24T11:30:00Z,1,39.2457,-4.83984,Tanga,Mkinga,Zingibari,Petukiza,Kwamzungu,21,RN,Selar crumenophthalmus,Caranx,NA,60,3,60,60
25/02/2020,2,NE,2020-02-25T02:30:00Z,2020-02-25T06:00:00Z,3.5,39.15554,-4.78786,Tanga,Mkinga,Zingibari,Petukiza,Bunju,17,RN,Auxis thazard,Tuna,NA,340,34,97.14285714,97.14285714
25/02/2020,2,NE,2020-02-25T06:20:00Z,2020-02-25T09:15:00Z,2.92,39.20936,-6.64101,Dar es Salaam,Kinondoni,Kunduchi Pwani,Kunduchi Pwani,Ununio,59,RN,Sardine,Sardines,NA,350,350,120,119.8630137
25/02/2020,2,NE,2020-02-25T08:14:00Z,2020-02-25T12:53:00Z,4.65,40.37448,-10.31507,Mtwara,Mtwara Rural,Mnazi,Mnazi Bay,MLAMBA,18,RN,Caranx tille,Caranx,NA,40,4,8.602150538,8.602150538
25/02/2020,2,NE,2020-02-25T11:00:00Z,2020-02-25T14:00:00Z,3,39.15554,-4.78786,Tanga,Mkinga,Zingibari,Petukiza,Funguni,17,RN,Auxis thazard,Tuna,NA,340,34,113.3333333,113.3333333
25/02/2020,2,NE,2020-02-25T20:59:00Z,2020-02-26T05:30:00Z,8.52,39.22794,-4.72497,Tanga,Mkinga,Zingibari,Petukiza,Kwamzungu,23,RN,Sardine,Sardines,NA,300,30,35.22504892,35.21126761
26/02/2020,2,NE,2020-02-26T06:05:00Z,2020-02-26T10:00:00Z,3.92,39.20932,-6.64096,Dar es Salaam,Kinondoni,Kunduchi Pwani,Kunduchi Pwani,Uninio,55,RN,Sardine,Sardines,NA,240,24,61.27659574,61.2244898
26/02/2020,2,NE,2020-02-26T07:20:00Z,2020-02-26T10:50:00Z,3.5,40.37954,-10.30998,Mtwara,Mtwara Urban,Kiyanga,Uyavi,VETA,20,RN,Auxis thazard,Tuna,NA,260,400,74.28571429,74.28571429
26/02/2020,2,NE,2020-02-26T19:00:00Z,2020-02-27T05:30:00Z,10.5,39.66108,-5.06474,Pemba,Wete,Selemu,Wete Pwani,Fundo,18,RN,Decapterus macrosoma,Mackerel,Msumari,540,27,51.42857143,51.42857143
26/02/2020,2,NE,2020-02-26T19:02:00Z,2020-02-27T04:14:00Z,9.2,39.05959,-5.56092,Tanga,Pangani,Pangani Mashariki,Magarawani,Dachi,22,RN,Sardine,Sardines,NA,40,2,4.347826087,4.347826087
26/02/2020,2,NE,2020-02-26T19:25:00Z,2020-02-27T05:30:00Z,10.08,39.67394,-7.84595,Pwani,Mafia,Chunguruma,Tumbuju,Mfuluni,12,RN,Dagaa,Anchovy,Dagaa mchele,50,5,4.96031746,4.96031746
26/02/2020,2,NE,2020-02-26T20:00:00Z,2020-02-26T23:00:00Z,3,39.15791,-4.7847,Tanga,Mkinga,Zingibari,Petukiza,Kishangani,23,RN,Dussumieria acuta,Anchovy,NA,500,25,166.6666667,166.6666667
26/02/2020,2,NE,2020-02-26T23:38:00Z,2020-02-27T01:38:00Z,2,39.15819,-4.78462,Tanga,Mkinga,Zingibari,Petukiza,Kiroba,20,RN,Sardine,Sardines,NA,300,15,150,150
27/02/2020,2,NE,2020-02-27T02:00:00Z,2020-02-27T06:30:00Z,4.5,39.15549,-4.78786,Tanga,Mkinga,Zingibari,Petukiza,Mwani,18,RN,Sphyraena putnamiae,Dermesal,NA,10,9,2.222222222,2.222222222
27/02/2020,2,NE,2020-02-27T06:00:00Z,2020-02-27T12:00:00Z,6,39.29304,-8.39226,Lindi,Kilwa,Somanga,Mbuyuni,Mwamba uso,9,RN,Loligo spp,Others,NA,8,4,1.333333333,1.333333333
27/02/2020,2,NE,2020-02-27T06:30:00Z,2020-02-27T12:20:00Z,5.83,40.3392,-10.33543,Mtwara,Mtwara Urban,Shangani East,Feri,Veta,28,RN,Auxis rochei,Tuna,NA,80.5,161,13.8,13.80789022
27/02/2020,2,NE,2020-02-27T06:30:00Z,2020-02-27T12:20:00Z,5.83,40.33005,-10.33729,Mtwara,Mtwara Urban,Shangani East,Feri,Veta,28,RN,Decapterus russelli,Mackerel,NA,12,26,2.057142857,2.058319039
27/02/2020,2,NE,2020-02-27T06:35:00Z,2020-02-27T12:45:00Z,6.17,40.32661,-10.35315,Mtwara,Mtwara Urban,Kiyanga,Uyavi,Mwantuona,23,RN,Katsuwonus pelamis,Tuna,NA,42,70,6.81081081,6.80713128
27/02/2020,2,NE,2020-02-27T06:40:00Z,2020-02-27T09:11:00Z,2.52,39.65285,-6.65285,Dar es Salaam,Kinondoni,Kunduchi Pwani,Kunduchi Pwani,Ununio,52,RN,Sardine,Sardines,NA,220,22,87.41721853,87.3015873
27/02/2020,2,NE,2020-02-27T08:00:00Z,2020-02-27T11:30:00Z,3.5,39.148,-5.4139,Tanga,Pangani,Kipumbwi,Kipumbwi,Mkwaja,18,RN,Amblygaster sirm,Anchovy,NA,320,4,91.42857143,91.42857143
27/02/2020,2,NE,2020-02-27T08:00:00Z,2020-02-27T13:08:00Z,5.13,39.20105,-4.89371,Tanga,Mkinga,Zingibari,Petukiza,Mwani,17,RN,Caranx tille,Caranx,NA,300,8000,58.44155845,58.47953216
27/02/2020,2,NE,2020-02-27T09:30:00Z,2020-02-27T13:30:00Z,4,38.98756,-6.25681,Pwani,Bagamoyo,Mwambao,Kastam(Custom),Manyema,42,RN,Decapterus kurroides,Mackerel,NA,120,6,30,30
27/02/2020,2,NE,2020-02-27T09:30:00Z,2020-02-27T13:30:00Z,4,38.98756,-6.25681,Pwani,Bagamoyo,Mwambao,Kastam(Custom),Manyema,42,RN,Rastrelliger kanagurta,Mackerel,NA,80,4,20,20
27/02/2020,2,NE,2020-02-27T18:30:00Z,2020-02-28T06:30:00Z,12,39.0984,-5.25366,Tanga,Muheza,Kigombe,Kigombe,Taa,16,RN,Sardine,Sardines,NA,200,10,16.66666667,16.66666667
27/02/2020,2,NE,2020-02-27T19:00:00Z,2020-02-28T05:30:00Z,10.5,39.66108,-5.06474,Pemba,Wete,Selemu,Wete Pwani,Fundo,18,RN,Decapterus macrosoma,Mackerel,Msumari,320,16,30.47619048,30.47619048
27/02/2020,2,NE,2020-02-27T19:20:00Z,2020-02-28T04:52:00Z,9.53,38.95176,-5.9618,Unguja,Kaskazini A,Mkokotoni,Nungwi,MELIN,20,GN,Mackerel(scomber),Mackerel,NA,200,10,20.97902098,20.98635887
27/02/2020,2,NE,2020-02-27T19:35:00Z,2020-02-28T06:30:00Z,10.92,39.096,-5.26873,Tanga,Muheza,Kigombe,Kigombe,Mundura,17,RN,Sardine,Sardines,NA,220,11,20.15267175,20.14652015
27/02/2020,2,NE,2020-02-27T19:42:00Z,2020-02-28T05:20:00Z,9.63,39.09618,-5.05074,Tanga,Tanga City,Sahare,Kasera,Jambe,12,RN,Stolephorus commersonii,Anchovy,NA,200,10,20.76124568,20.76843198
27/02/2020,2,NE,2020-02-27T19:45:00Z,2020-02-28T05:30:00Z,9.75,39.12928,-5.08761,Tanga,Tanga City,Sahare,Kasera,Ulenge,16,RN,Sardine,Sardines,NA,140,7,14.35897436,14.35897436
27/02/2020,2,NE,2020-02-27T20:00:00Z,2020-02-27T22:00:00Z,2,39.25973,-4.8222,Tanga,Mkinga,Zingibari,Petukiza,Keamzungu,22,RN,Stolephorus commersonii,Anchovy,NA,100,5,50,50
27/02/2020,2,NE,2020-02-27T20:03:00Z,2020-02-28T05:00:00Z,8.95,39.04529,-5.39559,Tanga,Pangani,Pangani Mashariki,Magarawani,Mwanaunguja,22,RN,Dussumieria acuta,Anchovy,NA,400,20,44.69273743,44.69273743
28/02/2020,2,NE,2020-02-28T06:12:00Z,2020-02-28T12:30:00Z,6.3,40.33005,-10.33729,Mtwara,Mtwara Urban,Shangani East,Feri,Jeshini Juu,22,RN,Auxis rochei,Tuna,NA,24.5,35,3.888888889,3.888888889
28/02/2020,2,NE,2020-02-28T06:30:00Z,2020-02-28T09:14:00Z,2.73,39.19875,-6.62859,Dar es Salaam,Kinondoni,Kunduchi Pwani,Kunduchi Pwani,Ununio,49,RN,Stolephorus devisi,Anchovy,NA,640,34,234.1463415,234.4322344
28/02/2020,2,NE,2020-02-28T07:10:00Z,2020-02-28T10:00:00Z,2.83,40.3822,-10.33627,Mtwara,Mtwara Urban,Kiyanga,Uyavi,Mwantuona,22,RN,Auxis rochei,Tuna,NA,47,94,16.5882353,16.60777385
28/02/2020,2,NE,2020-02-28T08:15:00Z,2020-02-28T12:30:00Z,4.25,39.22711,-4.73673,Tanga,Mkinga,Zingibari,Petukiza,Minyani,19,RN,Dussumieria acuta,Anchovy,NA,200,10,47.05882353,47.05882353
28/02/2020,2,NE,2020-02-28T17:37:00Z,2020-02-29T00:15:00Z,6.63,39.2092,-5.05881,Tanga,Muheza,Kigombe,Kigombe,Mwana unguja,19,RN,Sardine,Sardines,NA,200,10,30.15075377,30.16591252
28/02/2020,2,NE,2020-02-28T18:00:00Z,2020-02-29T05:00:00Z,11,39.28677,-8.39087,Lindi,Kilwa,Somanga,Mbuyuni,Fungu mbili,12,RN,Sardine,Sardines,NA,460,23,41.81818182,41.81818182
28/02/2020,2,NE,2020-02-28T19:00:00Z,2020-02-29T05:30:00Z,10.5,39.66108,-5.06474,Pemba,Wete,Selemu,Wete Pwani,Fundo,18,RN,Decapterus macrosoma,Mackerel,Msumari,440,22,41.9047619,41.9047619
28/02/2020,2,NE,2020-02-28T19:15:00Z,2020-02-29T06:30:00Z,11.25,39.252,-5.36974,Tanga,Muheza,Kigombe,Kigombe,Mwanaunguja,20,RN,Sardine,Sardines,NA,240,12,21.33333333,21.33333333
28/02/2020,2,NE,2020-02-28T19:30:00Z,2020-02-29T05:20:00Z,9.83,39.60024,-5.31754,Pemba,Pemba Kusini,Mbuyuni,Ngazini,Mtipe,22,RN,Sardine,Sardines,NA,1000,50,101.6949153,101.7293998
28/02/2020,2,NE,2020-02-28T20:00:00Z,2020-02-29T06:00:00Z,10,39.059222,-5.4976,Tanga,Pangani,Pangani Mashariki,Magarawani,Mto maziwe,24,RN,Sardine,Sardines,NA,320,16,32,32
29/02/2020,2,NE,2020-02-29T02:00:00Z,2020-02-29T05:00:00Z,3,39.0723,-5.49296,Tanga,Pangani,Pangani Mashariki,Magarawani,Mwambani,24,RN,Sardine,Sardines,NA,200,10,66.66666667,66.66666667
29/02/2020,2,NE,2020-02-29T06:30:00Z,2020-02-29T10:50:00Z,4.33,40.33005,-10.33729,Mtwara,Mtwara Urban,Shangani East,Feri,Msangamkuu,21,RN,Katsuwonus pelamis,Tuna,NA,NA,NA,0,NA
29/02/2020,2,NE,2020-02-29T07:30:00Z,2020-02-29T11:00:00Z,3.5,39.28327,-8.39304,Lindi,Kilwa,Somanga,Mbuyuni,Chocha,13,RN,Sardine,Sardines,NA,1088,60,310.8571429,310.8571429
29/02/2020,2,NE,2020-02-29T19:00:00Z,2020-03-01T06:00:00Z,11,39.35066,-6.78966,Dar es Salaam,Kigamboni,Minazi  Mikinda,Minazi Mikinda,Katumbi,25,RN,Sardine,Sardines,NA,300,15,27.27272727,27.27272727
29/02/2020,2,NE,2020-02-29T19:00:00Z,2020-03-01T05:30:00Z,10.5,39.66108,-5.06474,Pemba,Wete,Selemu,Wete Pwani,Fundo,18,RN,Decapterus macrosoma,Mackerel,Msumari,120,6,11.42857143,11.42857143
29/02/2020,2,NE,2020-02-29T19:46:00Z,2020-02-29T23:46:00Z,4,38.97392,-5.89648,Unguja,Kaskazini A,Mkokotoni,Nungwi,SABA,22,GN,Dussumieria acuta,Anchovy,NA,160,8,40,40
29/02/2020,2,NE,2020-02-29T19:46:00Z,2020-02-29T23:46:00Z,4,38.97392,-5.89648,Unguja,Kaskazini A,Mkokotoni,Nungwi,SABA,22,GN,Mackerel(scomber),Mackerel,NA,100,5,25,25
29/02/2020,2,NE,2020-02-29T20:00:00Z,2020-03-01T05:30:00Z,9.5,39.60024,-5.31754,Pemba,Pemba Kusini,Mbuyuni,Ngazini,Mtipe,22,RN,Rastrelliger faughni,Mackerel,NA,50,2.5,5.263157895,5.263157895
29/02/2020,2,NE,2020-02-29T20:00:00Z,2020-03-01T05:30:00Z,9.5,39.60024,-5.31754,Pemba,Pemba Kusini,Mbuyuni,Ngazini,Mtipe,22,RN,Sardine,Sardines,NA,620,31,65.26315789,65.26315789
01/03/2020,3,NE,2020-03-01T18:00:00Z,2020-03-02T06:00:00Z,12,39.28677,-8.39088,Lindi,Kilwa,Somanga,Mbuyuni,Fungu mbili,12,RN,Sardine,Sardines,NA,640,32,53.33333333,53.33333333
01/03/2020,3,NE,2020-03-01T19:00:00Z,2020-03-02T05:30:00Z,10.5,39.66108,-5.6474,Pemba,Wete,Selemu,Wete Pwani,Fundo,18,RN,Decapterus macrosoma,Mackerel,Msumari,80,4,7.619047619,7.619047619
01/03/2020,3,NE,2020-03-01T20:00:00Z,2020-03-02T05:20:00Z,9.33,39.60024,-5.31754,Pemba,Pemba Kusini,Mbuyuni,Ngazini,Mtipe,26,RN,Rastrelliger faughni,Mackerel,NA,25,1,2.678571429,2.679528403
01/03/2020,3,NE,2020-03-01T20:00:00Z,2020-03-02T05:20:00Z,9.33,39.6004,-5.31754,Pemba,Pemba Kusini,Mbuyuni,Ngazini,Mtipe,26,RN,Sardine,Sardines,NA,360,18,38.57142857,38.585209
02/03/2020,3,NE,2020-03-02T07:00:00Z,2020-03-02T12:00:00Z,5,39.30566,-8.23881,Lindi,Kilwa,Somanga,Mbuyuni,Makatoni,14,RN,Auxis thazard,Tuna,NA,60,5,12,12
02/03/2020,3,NE,2020-03-02T07:00:00Z,2020-03-02T11:30:00Z,4.5,39.66108,-5.6474,Pemba,Wete,Selemu,Wete Pwani,Fundo,18,RN,Decapterus macrosoma,Mackerel,Msumari,120,6,26.66666667,26.66666667
02/03/2020,3,NE,2020-03-02T08:30:00Z,2020-03-02T13:00:00Z,4.5,39.07079,-6.4088,Pwani,Bagamoyo,Mwambao,Kastam(Custom),Mshingwi,44,RN,Decapterus kurroides,Mackerel,NA,240,12,53.33333333,53.33333333
02/03/2020,3,NE,2020-03-02T18:00:00Z,2020-03-03T05:10:00Z,11.17,39.4048,-8.42108,Lindi,Kilwa,Somanga,Mbuyuni,Chocha,14,RN,Sardine,Sardines,NA,720,40,64.47761192,64.45837064
02/03/2020,3,NE,2020-03-02T19:00:00Z,2020-03-03T06:00:00Z,11,39.30566,-8.23881,Lindi,Kilwa,Somanga,Mbuyuni,Makatoni,14,RN,Amblygaster sirm,Anchovy,NA,60,5,5.454545455,5.454545455
02/03/2020,3,NE,2020-03-02T20:00:00Z,2020-03-03T05:30:00Z,9.5,39.60024,-5.31754,Pemba,Pemba Kusini,Mbuyuni,Ngazini,Mtipe,13,RN,Sardine,Sardines,NA,220,11,23.15789474,23.15789474
02/03/2020,3,NE,2020-03-02T20:00:00Z,2020-03-03T05:30:00Z,9.5,39.60024,-5.31754,Pemba,Pemba Kusini,Mbuyuni,Ngazini,Mtipe,13,RN,Sardine,Sardines,NA,220,11,23.15789474,23.15789474
03/03/2020,3,NE,2020-03-03T07:00:00Z,2020-03-03T09:30:00Z,2.5,39.3951,-6.84737,Dar es Salaam,Kigamboni,Minazi  Mikinda,Minazi Mikinda,Kijiweni,16,RN,Euthynnus affinis,Tuna,NA,40,2,16,16
03/03/2020,3,NE,2020-03-03T08:05:00Z,2020-03-03T13:00:00Z,4.92,39.20105,-4.89371,Tanga,Mkinga,Zingibari,Petukiza,Funguni,27,RN,Caranx tille,Caranx,NA,3,100,0.610169491,0.609756098
03/03/2020,3,NE,2020-03-03T09:16:00Z,2020-03-03T12:37:00Z,3.35,39.50768,-8.79053,Lindi,Kilwa,Magengeni,Magengeni,Mpovi,39,RN,Scomberomorus plurilineatus,Tuna,NA,559.5,373,167.0149254,167.0149254
03/03/2020,3,NE,2020-03-03T19:00:00Z,2020-03-04T06:00:00Z,11,39.35022,-6.78985,Dar es Salaam,Kigamboni,Minazi  Mikinda,Minazi Mikinda,Katumbi,25,RN,Sardine,Sardines,NA,1000,50,90.90909091,90.90909091
03/03/2020,3,NE,2020-03-03T19:15:00Z,2020-03-04T05:20:00Z,10.08,39.433125,-7.47074,Pwani,Mafia,Chunguruma,Tumbuju,Mbarakuni,18,RN,Dagaa,Anchovy,Dagaa mchele,1300,65,128.968254,128.968254
03/03/2020,3,NE,2020-03-03T20:00:00Z,2020-03-04T05:20:00Z,9.33,39.61575,-5.30182,Pemba,Pemba Kusini,Mbuyuni,Ngazini,Mtipe,23,RN,Dussumieria acuta,Anchovy,NA,70,3.5,7.5,7.502679528
03/03/2020,3,NE,2020-03-03T20:00:00Z,2020-03-04T05:20:00Z,9.33,39.61575,-5.30182,Pemba,Pemba Kusini,Mbuyuni,Ngazini,Mtipe,23,RN,Rastrelliger kanagurta,Mackerel,NA,60,3,6.428571429,6.430868167
03/03/2020,3,NE,2020-03-03T21:08:00Z,2020-03-03T23:39:00Z,2.52,39.15792,-4.78498,Tanga,Mkinga,Zingibari,Petukiza,Kwamzungu,23,RN,Sardine,Sardines,NA,100,5,39.73509933,39.68253968
04/03/2020,3,NE,2020-03-04T08:30:00Z,2020-03-04T14:30:00Z,6,39.01284,-6.37427,Pwani,Bagamoyo,Mwambao,Kastam(Custom),Mwambakuni,43,RN,Rastrelliger kanagurta,Mackerel,NA,NA,NA,0,NA
05/03/2020,3,NE,2020-03-05T10:30:00Z,2020-03-05T13:00:00Z,2.5,39.55327,-8.54538,Lindi,Kilwa,Magengeni,Magengeni,Njovi,44,RN,Amblygaster sirm,Anchovy,NA,720,20,288,288
05/03/2020,3,NE,2020-03-05T20:00:00Z,2020-03-06T06:00:00Z,10,39.60024,-5.31754,Pemba,Pemba Kusini,Mbuyuni,Ngazini,Mtipe,23,RN,Atule mate,Mackerel,NA,80,4,8,8
05/03/2020,3,NE,2020-03-05T20:00:00Z,2020-03-06T06:00:00Z,10,39.60024,-5.31754,Pemba,Pemba Kusini,Mbuyuni,Ngazini,Mtipe,23,RN,Dussumieria acuta,Anchovy,NA,60,3,6,6
06/03/2020,3,NE,2020-03-06T07:00:00Z,2020-03-06T11:00:00Z,4,39.43612,-8.413,Lindi,Kilwa,Somanga,Mbuyuni,Fungu mbili,14,RN,Caranx tille,Caranx,NA,90,15,22.5,22.5
07/03/2020,3,NE,2020-03-07T08:45:00Z,2020-03-07T12:41:00Z,3.93,38.99978,-6.29081,Pwani,Bagamoyo,Mwambao,Kastam(Custom),Mwambakuni,25,RN,Decapterus kurroides,Mackerel,NA,NA,NA,0,NA
08/03/2020,3,NE,2020-03-08T07:15:00Z,2020-03-08T11:00:00Z,3.75,39.29688,-6.77427,Dar es Salaam,Kigamboni,Minazi  Mikinda,Minazi Mikinda,Kokobichi,35,RN,Sardine,Sardines,NA,600,30,160,160
08/03/2020,3,NE,2020-03-08T09:00:00Z,2020-03-08T12:30:00Z,3.5,39.2197,-4.81951,Tanga,Mkinga,Zingibari,Petukiza,Mwezi,18,RN,Sphyraena putnamiae,Dermesal,NA,5,4,1.428571429,1.428571429
08/03/2020,3,NE,2020-03-08T19:10:00Z,2020-03-09T04:50:00Z,9.67,40.32671,-10.35347,Mtwara,Mtwara Rural,Mnazi,Mnazi Bay,KIPWA,19,RN,Sardine,Sardines,NA,160,4,16.55172414,16.54601861
09/03/2020,3,NE,2020-03-09T02:00:00Z,2020-03-09T05:10:00Z,3.17,39.34877,-4.82381,Tanga,Mkinga,Zingibari,Petukiza,Koleo,35,RN,Acanthurus spp,Reef,NA,10,2,3.157894737,3.154574132
09/03/2020,3,NE,2020-03-09T06:30:00Z,2020-03-09T11:40:00Z,5.17,40.40083,-10.34656,Mtwara,Mtwara Urban,Shangani East,Feri,Kivale Chini,24,RN,Auxis thazard,Tuna,NA,21,30,4.064516129,4.061895551
09/03/2020,3,NE,2020-03-09T07:05:00Z,2020-03-09T10:55:00Z,3.83,40.3574,-10.33228,Mtwara,Mtwara Rural,Mnazi,Mnazi Bay,KIPWA,19,RN,Sardine,Sardines,NA,100,5,26.08695652,26.10966057
09/03/2020,3,NE,2020-03-09T07:05:00Z,2020-03-09T10:55:00Z,3.83,40.33271,-10.34175,Mtwara,Mtwara Rural,Mnazi,Mnazi Bay,KIPWA,19,RN,Sardine,Sardines,NA,100,5,26.08695652,26.10966057
09/03/2020,3,NE,2020-03-09T07:05:00Z,2020-03-09T10:55:00Z,3.83,40.3266,-10.35313,Mtwara,Mtwara Rural,Mnazi,Mnazi Bay,KIPWA,19,RN,Sardine,Sardines,NA,100,5,26.08695652,26.10966057
09/03/2020,3,NE,2020-03-09T07:05:00Z,2020-03-09T10:55:00Z,3.83,40.32661,-10.35313,Mtwara,Mtwara Rural,Mnazi,Mnazi Bay,KIPWA,19,RN,Sardine,Sardines,NA,100,5,26.08695652,26.10966057
09/03/2020,3,NE,2020-03-09T07:05:00Z,2020-03-09T10:55:00Z,3.83,40.3392,-10.33543,Mtwara,Mtwara Rural,Mnazi,Mnazi Bay,KIPWA,19,RN,Sardine,Sardines,NA,100,5,26.08695652,26.10966057
09/03/2020,3,NE,2020-03-09T07:10:00Z,2020-03-09T10:55:00Z,3.75,40.32671,-10.35347,Mtwara,Mtwara Rural,Mnazi,Mnazi Bay,KIPWA,19,RN,Sardine,Sardines,NA,100,5,26.66666667,26.66666667
09/03/2020,3,NE,2020-03-09T07:30:00Z,2020-03-09T12:00:00Z,4.5,39.05874,-6.31914,Pwani,Bagamoyo,Mwambao,Kastam(Custom),Boribo,50,RN,Decapterus kurroides,Mackerel,NA,400,20,88.88888889,88.88888889
09/03/2020,3,NE,2020-03-09T09:10:00Z,2020-03-09T11:30:00Z,2.33,39.1984,-4.77938,Tanga,Mkinga,Zingibari,Petukiza,Mwezi,18,RN,Sphyraena putnamiae,Dermesal,NA,10,5,4.285714286,4.291845494
10/03/2020,3,NE,2020-03-10T07:30:00Z,2020-03-10T11:00:00Z,3.5,39.06293,-6.32436,Pwani,Bagamoyo,Mwambao,Kastam(Custom),Boribo,45,RN,Decapterus kurroides,Mackerel,NA,200,10,57.14285714,57.14285714
10/03/2020,3,NE,2020-03-10T07:30:00Z,2020-03-10T11:00:00Z,3.5,39.08726,-6.3503,Pwani,Bagamoyo,Mwambao,Kastam(Custom),Boribo,45,RN,Decapterus kurroides,Mackerel,NA,NA,NA,0,NA
10/03/2020,3,NE,2020-03-10T08:00:00Z,2020-03-10T12:00:00Z,4,39.43612,-8.41301,Lindi,Kilwa,Somanga,Mbuyuni,Sakaulu,14,RN,Sphyraena putnamiae,Dermesal,NA,24,2,6,6
10/03/2020,3,NE,2020-03-10T09:00:00Z,2020-03-10T11:30:00Z,2.5,39.21144,-4.78398,Tanga,Mkinga,Zingibari,Petukiza,Bunju,17,RN,Auxis thazard,Tuna,NA,10,10,4,4
10/03/2020,3,NE,2020-03-10T09:20:00Z,2020-03-10T10:30:00Z,1.17,40.33005,-10.33729,Mtwara,Mtwara Rural,Mnazi,Mnazi Bay,HALFAN,19,RN,Caranx tille,Caranx,NA,50,5,42.85714284,42.73504274
11/03/2020,3,NE,2020-03-11T07:03:00Z,2020-03-11T12:30:00Z,5.45,39.09765,-6.35619,Pwani,Bagamoyo,Mwambao,Kastam(Custom),Boribo,50,RN,Decapterus kurroides,Mackerel,NA,460,23,84.40366972,84.40366972
11/03/2020,3,NE,2020-03-11T07:04:00Z,2020-03-11T11:18:00Z,4.23,39.15803,-4.78489,Tanga,Mkinga,Zingibari,Petukiza,Sayona,20,RN,Sardine,Sardines,NA,100,5,23.62204725,23.64066194
11/03/2020,3,NE,2020-03-11T07:23:00Z,2020-03-11T11:30:00Z,4.12,40.32654,-10.3532,Mtwara,Mtwara Urban,Kiyanga,Uyavi,Naumbu Chini,22,RN,Auxis rochei,Tuna,NA,180,300,43.72469635,43.68932039
11/03/2020,3,NE,2020-03-11T07:30:00Z,2020-03-11T12:00:00Z,4.5,39.43612,-8.41301,Lindi,Kilwa,Somanga,Mbuyuni,Sakaulu,14,RN,Sphyraena putnamiae,Dermesal,NA,48,4,10.66666667,10.66666667
11/03/2020,3,NE,2020-03-11T08:01:00Z,2020-03-11T09:00:00Z,0.98,39.34877,-4.82381,Tanga,Mkinga,Zingibari,Petukiza,Koleo,60,RN,Sphyraena putnamiae,Dermesal,NA,10,16,10.16949153,10.20408163
11/03/2020,3,NE,2020-03-11T09:00:00Z,2020-03-11T14:30:00Z,5.5,39.06012,-6.36235,Pwani,Bagamoyo,Mwambao,Kastam(Custom),Boribo,37,RN,Decapterus kurroides,Mackerel,NA,200,10,36.36363636,36.36363636
11/03/2020,3,NE,2020-03-11T09:00:00Z,2020-03-11T12:30:00Z,3.5,39.21207,-4.78734,Tanga,Mkinga,Zingibari,Petukiza,Mwezi,18,RN,Sphyraena putnamiae,Dermesal,NA,10,7,2.857142857,2.857142857
12/03/2020,3,NE,2020-03-12T01:00:00Z,2020-03-12T05:00:00Z,4,39.54877,-4.82381,Tanga,Mkinga,Zingibari,Petukiza,Koleo,41,RN,Acanthurus spp,Reef,NA,10,6,2.5,2.5
12/03/2020,3,NE,2020-03-12T07:20:00Z,2020-03-12T10:30:00Z,3.17,40.33006,-10.322332,Mtwara,Mtwara Urban,Kiyanga,Uyavi,Kimbindu,20,RN,Auxis rochei,Tuna,NA,175,250,55.26315789,55.20504732
12/03/2020,3,NE,2020-03-12T10:00:00Z,2020-03-12T13:00:00Z,3,39.18984,-4.781,Tanga,Mkinga,Zingibari,Petukiza,Mwani,17,RN,Upeneus spp,Dermesal,NA,10,10,3.333333333,3.333333333
13/03/2020,3,NE,2020-03-13T06:45:00Z,2020-03-13T10:30:00Z,3.75,39.51452,-4.4452,Pemba,Wete,Fundo,Fundo,Bahari kuu,4,SK,Katsuwonus pelamis,Tuna,NA,6,2,1.6,1.6
13/03/2020,3,NE,2020-03-13T06:45:00Z,2020-03-13T10:30:00Z,3.75,39.51452,-4.4452,Pemba,Wete,Fundo,Fundo,Bahari kuu,4,SK,Xiphiasgladius spp,Tuna,NA,47,3,12.53333333,12.53333333
13/03/2020,3,NE,2020-03-13T20:25:00Z,2020-03-14T04:04:00Z,7.65,39.7419,-7.81505,Pwani,Mafia,Chunguruma,Tumbuju,Mbakale,18,RN,Sardine,Sardines,NA,684,38,89.41176471,89.41176471
13/03/2020,3,NE,2020-03-13T20:25:00Z,2020-03-14T04:04:00Z,7.65,39.7419,-7.81505,Pwani,Mafia,Chunguruma,Tumbuju,Mbakale,18,RN,Sardine,Sardines,Dagaa,684,38,89.41176471,89.41176471
14/03/2020,3,NE,2020-03-14T07:00:00Z,2020-03-14T12:00:00Z,5,39.179,-6.468,Dar es Salaam,Kigamboni,Minazi  Mikinda,Minazi Mikinda,Kokobichi,35,RN,Sardine,Sardines,NA,260,13,52,52
14/03/2020,3,NE,2020-03-14T07:30:00Z,2020-03-14T12:50:00Z,5.33,40.33005,-10.33729,Mtwara,Mtwara Rural,Mnazi,Mnazi Bay,HAFANI,24,RN,Rastrelliger kanagurta,Mackerel,NA,40,2,7.5,7.504690432
14/03/2020,3,NE,2020-03-14T19:30:00Z,2020-03-15T03:30:00Z,8,39.68995,-7.78735,Pwani,Mafia,Chunguruma,Tumbuju,Chumani,20,RN,Dagaa,Anchovy,Dagaa mchele,360,18,45,45
14/03/2020,3,NE,2020-03-14T21:43:00Z,2020-03-15T04:18:00Z,6.58,39.7419,-7.81305,Pwani,Mafia,Chunguruma,Tumbuju,Mbakale,16,RN,Gazza minuta,Dermesal,NA,18,19,2.734177215,2.73556231
14/03/2020,3,NE,2020-03-14T21:43:00Z,2020-03-15T04:18:00Z,6.58,39.7419,-7.81305,Pwani,Mafia,Chunguruma,Tumbuju,Mbakale,16,RN,Gazza minuta,Dermesal,Parawe,342,19,51.97568389,51.97568389
15/03/2020,3,NE,2020-03-15T02:00:00Z,2020-03-15T04:00:00Z,2,39.34877,-4.82381,Tanga,Mkinga,Zingibari,Petukiza,Kole,41,RN,Caranx tille,Caranx,NA,60,6,30,30
15/03/2020,3,NE,2020-03-15T07:00:00Z,2020-03-15T10:00:00Z,3,39.146,-6.236,Dar es Salaam,Kigamboni,Minazi  Mikinda,Minazi Mikinda,Kijambani,35,RN,Sardine,Sardines,NA,100,5,33.33333333,33.33333333
15/03/2020,3,NE,2020-03-15T09:16:00Z,2020-03-15T11:06:00Z,1.83,40.3392,-10.33543,Mtwara,Mtwara Rural,Mnazi,Mnazi Bay,MLAMBA,18,RN,Caranx tille,Caranx,NA,26.5,53,14.45454546,14.48087432
15/03/2020,3,NE,2020-03-15T13:00:00Z,2020-03-15T17:00:00Z,4,39.34877,-4.82381,Tanga,Mkinga,Zingibari,Petukiza,Koleo,41,RN,Rastrelliger kanagurta,Mackerel,NA,40,30,10,10
15/03/2020,3,NE,2020-03-15T16:00:00Z,2020-03-15T22:00:00Z,6,39.24747,-4.74743,Tanga,Mkinga,Zingibari,Petukiza,Kwamzungu,20,RN,Sardine,Sardines,NA,300,15,50,50
15/03/2020,3,NE,2020-03-15T22:00:00Z,2020-03-16T03:00:00Z,5,40.38447,-10.34856,Mtwara,Mtwara Rural,Mnazi,Mnazi Bay,FUNGUNI,9,RN,Atule mate,Mackerel,NA,60,3,12,12
15/03/2020,3,NE,2020-03-15T22:00:00Z,2020-03-16T03:00:00Z,5,40.39243,-10.27424,Mtwara,Mtwara Rural,Mnazi,Mnazi Bay,FUNGUNI,9,RN,Atule mate,Mackerel,NA,60,3,12,12
15/03/2020,3,NE,2020-03-15T22:00:00Z,2020-03-16T03:00:00Z,5,40.39243,-10.27424,Mtwara,Mtwara Rural,Mnazi,Mnazi Bay,FUNGUNI,9,RN,Atule mate,Mackerel,NA,60,3,12,12
15/03/2020,3,NE,2020-03-15T22:55:00Z,2020-03-16T11:56:00Z,13.02,39.24078,-5.87839,Unguja,Kaskazini A,Mkokotoni,Nungwi,Marana kwamwan,16,GN,Dussumieria acuta,Anchovy,Dagaa sime ( simu),80,4,6.144393241,6.144393241
16/03/2020,3,NE,2020-03-16T06:25:00Z,2020-03-16T09:06:00Z,2.68,39.15821,-4.784558,Tanga,Mkinga,Zingibari,Petukiza,Kasa,21,RN,Rastrelliger kanagurta,Mackerel,NA,3,3000,1.118012422,1.119402985
16/03/2020,3,NE,2020-03-16T07:00:00Z,2020-03-16T13:30:00Z,6.5,39.325920000000004,-8.13231,Lindi,Kilwa,Somanga,Mbuyuni,Mawirani,14,RN,Sphyraena putnamiae,Dermesal,NA,24,12,3.692307692,3.692307692
16/03/2020,3,NE,2020-03-16T08:13:00Z,2020-03-16T10:25:00Z,2.2,40.33005,-10.33729,Mtwara,Mtwara Rural,Mnazi,Mnazi Bay,RASI  YA  MOA,18,RN,Caranx tille,Caranx,NA,20,2,9.090909091,9.090909091
16/03/2020,3,NE,2020-03-16T08:13:00Z,2020-03-16T10:25:00Z,2.2,40.33005,-10.33729,Mtwara,Mtwara Rural,Mnazi,Mnazi Bay,RASI YA  MOA,18,RN,Caranx tille,Caranx,NA,20,2,9.090909091,9.090909091
16/03/2020,3,NE,2020-03-16T11:00:00Z,2020-03-16T17:00:00Z,6,39.24561,-4.86421,Tanga,Mkinga,Zingibari,Petukiza,Kwamzungu,22,RN,Dussumieria acuta,Anchovy,NA,400,20,66.66666667,66.66666667
16/03/2020,3,NE,2020-03-16T19:48:00Z,2020-03-17T02:26:00Z,6.63,38.97872,-5.689383,Tanga,Pangani,Kipumbwi,Kipumbwi,Mijimile,22,RN,Sardine,Sardines,NA,40,1.5,6.030150754,6.033182504
16/03/2020,3,NE,2020-03-16T19:48:00Z,2020-03-17T02:26:00Z,6.63,38.97872,-5.689383,Tanga,Pangani,Kipumbwi,Kipumbwi,Mijimile,22,RN,Dagaa,Anchovy,Dagaa mchele,40,1.5,6.033182504,6.033182504
17/03/2020,3,NE,2020-03-17T01:00:00Z,2020-03-17T06:00:00Z,5,39.64241,-5.75354,Pemba,Wete,Fundo,Fundo,Bahari kuu,5,SK,Katsuwonus pelamis,Tuna,NA,34,16,6.8,6.8
17/03/2020,3,NE,2020-03-17T08:24:00Z,2020-03-17T11:16:00Z,2.87,40.40156,-10.28732,Mtwara,Mtwara Rural,Mnazi,Mnazi Bay,MCHATA,17,RN,Caranx tille,Caranx,NA,30,3,10.46511628,10.45296167
17/03/2020,3,NE,2020-03-17T08:24:00Z,2020-03-17T11:16:00Z,2.87,40.40083,-10.34656,Mtwara,Mtwara Rural,Mnazi,Mnazi Bay,MCHATA,17,RN,Sphyraena barracuda,Dermesal,NA,30,3,10.46511628,10.45296167
17/03/2020,3,NE,2020-03-17T08:24:00Z,2020-03-17T11:16:00Z,2.87,40.3758,-10.34526,Mtwara,Mtwara Rural,Mnazi,Mnazi Bay,MCHATA,17,RN,Sphyraena barracuda,Dermesal,NA,30,3,10.46511628,10.45296167
17/03/2020,3,NE,2020-03-17T08:24:00Z,2020-03-17T11:16:00Z,2.87,40.32662,-10.35322,Mtwara,Mtwara Rural,Mnazi,Mnazi Bay,MCHATA,17,RN,Sphyraena barracuda,Dermesal,NA,30,3,10.46511628,10.45296167
17/03/2020,3,NE,2020-03-17T18:00:00Z,2020-03-18T05:00:00Z,11,39.28675,-8.39087,Lindi,Kilwa,Somanga,Mbuyuni,Fungu mbili,12,RN,Sardine,Sardines,NA,44,22,4,4
17/03/2020,3,NE,2020-03-17T18:00:00Z,2020-03-18T02:00:00Z,8,39.31576,-8.2667,Lindi,Kilwa,Somanga,Mbuyuni,Makatoni,14,RN,Sardine,Sardines,NA,72,6,9,9
17/03/2020,3,NE,2020-03-17T19:32:00Z,2020-03-18T02:25:00Z,6.88,38.98148,-5.767983,Tanga,Pangani,Kipumbwi,Kipumbwi,Buyuni mkwaja,20,RN,Dagaa,Anchovy,Dagaa mchele,1400,70,203.4883721,203.4883721
17/03/2020,3,NE,2020-03-17T23:00:00Z,2020-03-18T05:00:00Z,6,39.37467,-8.431463,Lindi,Kilwa,Somanga,Mbuyuni,Fungu mbili,13,RN,Sardine,Sardines,NA,78,60,13,13
18/03/2020,3,NE,2020-03-18T01:10:00Z,2020-03-18T03:10:00Z,2,39.15455,-5.91175,Unguja,Kaskazini A,Mkokotoni,Nungwi,Mkokotoni,13,GN,Dussumieria acuta,Anchovy,Dagaa sime ( simu),170,7,85,85
18/03/2020,3,NE,2020-03-18T01:30:00Z,2020-03-18T07:11:00Z,5.68,39.64438,-5.727,Pemba,Wete,Fundo,Fundo,Bahari kuu,5,SK,Katsuwonus pelamis,Tuna,NA,23,9,4.046920821,4.049295775
18/03/2020,3,NE,2020-03-18T03:00:00Z,2020-03-18T06:00:00Z,3,39.34877,-4.8238,Tanga,Mkinga,Zingibari,Petukiza,Koleo,41,RN,Seriolina spp,Caranx,NA,50,5,16.66666667,16.66666667
18/03/2020,3,NE,2020-03-18T06:00:00Z,2020-03-18T10:30:00Z,4.5,39.24747,-4.71743,Tanga,Mkinga,Zingibari,Petukiza,Mwani,22,RN,Euthynnus affinis,Tuna,NA,100,200,22.22222222,22.22222222
18/03/2020,3,NE,2020-03-18T06:00:00Z,2020-03-18T12:30:00Z,6.5,39.31576,-8.26675,Lindi,Kilwa,Somanga,Mbuyuni,Kitutia,40,RN,Rastrelliger kanagurta,Mackerel,NA,72,6,11.07692308,11.07692308
18/03/2020,3,NE,2020-03-18T06:15:00Z,2020-03-18T08:16:00Z,2.02,39.36337,-6.43298,Dar es Salaam,Kinondoni,Kunduchi Pwani,Kunduchi Pwani,Bongoyo,60,RN,Etrumeus teres,Anchovy,NA,400,20,198.3471074,198.019802
18/03/2020,3,NE,2020-03-18T06:40:00Z,2020-03-18T11:30:00Z,4.83,40.32663,-10.35325,Mtwara,Mtwara Urban,Shangani East,Feri,Mkungu Juuu,23,RN,Sphyraena barracuda,Dermesal,NA,45,40,9.310344828,9.316770186
18/03/2020,3,NE,2020-03-18T08:40:00Z,2020-03-18T11:23:00Z,2.72,40.32662,-10.35322,Mtwara,Mtwara Rural,Mnazi,Mnazi Bay,KITITA,15,RN,Caranx tille,Caranx,NA,10,40,3.680981595,3.676470588
18/03/2020,3,NE,2020-03-18T09:00:00Z,2020-03-18T11:00:00Z,2,39.17617,-6.45545,Dar es Salaam,Kigamboni,Minazi  Mikinda,Minazi Mikinda,Kokobichi,35,RN,Sardine,Sardines,NA,500,25,250,250
18/03/2020,3,NE,2020-03-18T18:00:00Z,2020-03-19T05:00:00Z,11,39.28677,-8.39085,Lindi,Kilwa,Somanga,Mbuyuni,Machange,15,RN,Sardine,Sardines,NA,66,33,6,6
18/03/2020,3,NE,2020-03-18T18:45:00Z,2020-03-19T02:30:00Z,7.75,39.02385,-5.673583,Tanga,Pangani,Kipumbwi,Kipumbwi,Mijimile,22,RN,Sardine,Sardines,NA,900,45,116.1290323,116.1290323
18/03/2020,3,NE,2020-03-18T18:45:00Z,2020-03-19T02:30:00Z,7.75,39.02385,-5.673583,Tanga,Pangani,Kipumbwi,Kipumbwi,Mijimile,22,RN,Dagaa,Anchovy,Dagaa mchele,900,45,116.1290323,116.1290323
18/03/2020,3,NE,2020-03-18T19:26:00Z,2020-03-19T00:17:00Z,4.85,38.97462,-5.78,Tanga,Pangani,Kipumbwi,Kipumbwi,Mkwaja,22,RN,Sardine,Sardines,NA,920,46,189.6907216,189.6907216
18/03/2020,3,NE,2020-03-18T19:26:00Z,2020-03-19T00:17:00Z,4.85,38.97462,-5.78,Tanga,Pangani,Kipumbwi,Kipumbwi,Mkwaja,22,RN,Dagaa,Anchovy,Dagaa mchele,920,46,189.6907216,189.6907216
18/03/2020,3,NE,2020-03-18T21:20:00Z,2020-03-19T05:05:00Z,7.75,39.6685,-7.831,Pwani,Mafia,Chunguruma,Tumbuju,Mfuruni,18,RN,Trachinotus africanus,Caranx,Pandu,65.5,131,8.451612903,8.451612903
18/03/2020,3,NE,2020-03-18T23:00:00Z,2020-03-19T05:00:00Z,6,39.437467,-8.431463,Lindi,Kilwa,Somanga,Mbuyuni,Fungu mbili,13,RN,Sardine,Sardines,NA,68,5.666666,11.33333333,11.33333333
18/03/2020,3,NE,2020-03-18T23:00:00Z,2020-03-19T04:00:00Z,5,39.05959,-5.56092,Tanga,Pangani,Pangani Mashariki,Magarawani,Mwamba mawe,22,RN,Stolephorus devisi,Anchovy,NA,80,4,16,16
19/03/2020,3,NE,2020-03-19T01:00:00Z,2020-03-19T10:30:00Z,9.5,39.2379,-6.32409,Dar es Salaam,Kinondoni,Kunduchi Pwani,Kunduchi Pwani,Kipwani,25,RN,Sardine,Sardines,NA,240,12,25.26315789,25.26315789
19/03/2020,3,NE,2020-03-19T01:45:00Z,2020-03-19T06:00:00Z,4.25,39.64253,-5.07321,Pemba,Wete,Fundo,Fundo,Bahari kuu,5,SK,Katsuwonus pelamis,Tuna,NA,20,5,4.705882353,4.705882353
19/03/2020,3,NE,2020-03-19T02:00:00Z,2020-03-19T05:30:00Z,3.5,40.3758,-10.34526,Mtwara,Mtwara Rural,Mnazi,Mnazi Bay,MATENGA,10,RN,Coryphaena ssp,Tuna,NA,20,1,5.714285714,5.714285714
19/03/2020,3,NE,2020-03-19T06:23:00Z,2020-03-19T13:23:00Z,7,39.46147,-5.12077,Unguja,Kaskazini A,Mkokotoni,Nungwi,Mbumbwini,17,GN,Gayogayo,Dermesal,Gayogayo,NA,NA,NA,NA
19/03/2020,3,NE,2020-03-19T08:00:00Z,2020-03-19T14:00:00Z,6,39.2515,-4.7515,Tanga,Mkinga,Zingibari,Petukiza,Mwani,23,RN,Dussumieria acuta,Anchovy,NA,500,25,83.33333333,83.33333333
19/03/2020,3,NE,2020-03-19T08:00:00Z,2020-03-19T11:00:00Z,3,39.17618,-6.45548,Dar es Salaam,Kigamboni,Minazi  Mikinda,Minazi Mikinda,Bongoyo,35,RN,Sardine,Sardines,NA,440,22,146.6666667,146.6666667
19/03/2020,3,NE,2020-03-19T08:16:00Z,2020-03-19T10:20:00Z,2.07,40.32736,-10.331668,Mtwara,Mtwara Rural,Mnazi,Mnazi Bay,MLUNDO,16,RN,Coryphaena ssp,Tuna,NA,NA,NA,0,NA
19/03/2020,3,NE,2020-03-19T08:36:00Z,2020-03-19T12:05:00Z,3.48,39.15808,-4.78486,Tanga,Mkinga,Zingibari,Petukiza,H alid,22,RN,Encrasicholina heteroloba,Anchovy,NA,400,20,114.8325359,114.9425287
19/03/2020,3,NE,2020-03-19T09:40:00Z,2020-03-19T11:40:00Z,2,39.7481,-9.97559,Lindi,Lindi,Benki,Beach,Mwitingi,16,RN,Dussumieria acuta,Anchovy,NA,60,6,30,30
19/03/2020,3,NE,2020-03-19T18:15:00Z,2020-03-20T00:30:00Z,6.25,38.99387,-5.751817,Tanga,Pangani,Kipumbwi,Kipumbwi,Mkwaja,22,RN,Etrumeus teres,Anchovy,NA,600,30,96,96
19/03/2020,3,NE,2020-03-19T18:15:00Z,2020-03-20T05:00:00Z,10.75,39.4373,-8.42903,Lindi,Kilwa,Somanga,Mbuyuni,Fungu mbili,13,RN,Sardine,Sardines,NA,80,4,7.441860465,7.441860465
19/03/2020,3,NE,2020-03-19T18:15:00Z,2020-03-20T00:30:00Z,6.25,38.99387,-5.751817,Tanga,Pangani,Kipumbwi,Kipumbwi,Mkwaja,22,RN,Etrumeus teres,Anchovy,Uono kikwete,600,30,96,96
19/03/2020,3,NE,2020-03-19T18:15:00Z,2020-03-20T00:30:00Z,6.25,38.99387,-5.751817,Tanga,Pangani,Kipumbwi,Kipumbwi,Mkwaja,22,RN,Rastrelliger kanagurta,Mackerel,Kibua maji,600,30,96,96
19/03/2020,3,NE,2020-03-19T20:14:00Z,2020-03-20T04:05:00Z,7.85,39.12927,-5.08759,Tanga,Tanga City,Sahare,Kasera,Jambe,16,RN,Sardine,Sardines,NA,80,4,10.1910828,10.1910828
20/03/2020,3,NE,2020-03-20T01:00:00Z,2020-03-20T05:30:00Z,4.5,39.66108,-5.06474,Pemba,Wete,Selemu,Wete Pwani,Fundo,18,RN,Decapterus macrosoma,Mackerel,Msumari,260,13,57.77777778,57.77777778
20/03/2020,3,NE,2020-03-20T03:00:00Z,2020-03-20T05:00:00Z,2,40.39375,-10.33934,Mtwara,Mtwara Rural,Mnazi,Mnazi Bay,MATENGA,11,RN,Dussumieria acuta,Anchovy,NA,120,6,60,60
20/03/2020,3,NE,2020-03-20T03:30:00Z,2020-03-20T04:30:00Z,1,38.95163,-6.25848,Pwani,Bagamoyo,Mwambao,Kastam(Custom),Kitame,23,RN,Sardine,Sardines,NA,400,20,400,400
20/03/2020,3,NE,2020-03-20T06:00:00Z,2020-03-20T07:13:00Z,1.22,39.24747,-4.74743,Tanga,Mkinga,Zingibari,Petukiza,Mwani,20,RN,Dussumieria acuta,Anchovy,NA,400,20,328.7671232,327.8688525
20/03/2020,3,NE,2020-03-20T06:30:00Z,2020-03-20T11:40:00Z,5.17,40.38447,-10.34856,Mtwara,Mtwara Urban,Shangani East,Feri,Msangamkuu,20,RN,Auxis rochei,Tuna,NA,NA,NA,0,NA
20/03/2020,3,NE,2020-03-20T07:55:00Z,2020-03-20T11:16:00Z,3.35,39.74758,-9.97522,Lindi,Lindi,Benki,Beach,Mwitingi,15,RN,Chirocentrus dorab,Dermesal,NA,70,7,20.89552239,20.89552239
20/03/2020,3,NE,2020-03-20T07:55:00Z,2020-03-20T11:16:00Z,3.35,39.74758,-9.97522,Lindi,Lindi,Benki,Beach,Mwitingi,15,RN,Sardine,Sardines,NA,120,12,35.82089552,35.82089552
20/03/2020,3,NE,2020-03-20T08:15:00Z,2020-03-20T11:30:00Z,3.25,40.3266,-10.35225,Mtwara,Mtwara Rural,Mnazi,Mnazi Bay,MAKOGWA,17,RN,Coryphaena ssp,Tuna,NA,20,5,6.153846154,6.153846154
20/03/2020,3,NE,2020-03-20T08:15:00Z,2020-03-20T11:30:00Z,3.25,40.38447,-10.34856,Mtwara,Mtwara Rural,Mnazi,Mnazi Bay,MAKOGWA,17,RN,Coryphaena ssp,Tuna,NA,20,5,6.153846154,6.153846154
20/03/2020,3,NE,2020-03-20T08:15:00Z,2020-03-20T11:23:00Z,3.13,40.3758,-10.34526,Mtwara,Mtwara Rural,Mnazi,Mnazi Bay,MLAMBA,21,RN,Sphyraena barracuda,Dermesal,NA,45,4.5,14.36170213,14.37699681
20/03/2020,3,NE,2020-03-20T14:28:00Z,2020-03-20T15:29:00Z,1.02,39.12078,-5.92111,Unguja,Kaskazini A,Mkokotoni,Nungwi,Bumbuni,14,GN,Mackerel(scomber),Mackerel,Kibua,60,3,58.82352941,58.82352941
20/03/2020,3,NE,2020-03-20T18:00:00Z,2020-03-21T06:00:00Z,12,39.28776,-8.39086,Lindi,Kilwa,Somanga,Mbuyuni,Mwamba uso,15,RN,Sardine,Sardines,NA,32,16,2.666666667,2.666666667
20/03/2020,3,NE,2020-03-20T18:00:00Z,2020-03-21T05:00:00Z,11,39.28671,-8.39088,Lindi,Kilwa,Somanga,Mbuyuni,Fungu mbili,15,RN,Sardine,Sardines,NA,612,36,55.63636364,55.63636364
20/03/2020,3,NE,2020-03-20T18:50:00Z,2020-03-21T02:46:00Z,7.93,38.99378,-5.748117,Tanga,Pangani,Kipumbwi,Kipumbwi,Mkwaja,22,RN,Sardine,Sardines,NA,440,22,55.46218488,55.48549811
20/03/2020,3,NE,2020-03-20T18:50:00Z,2020-03-21T02:46:00Z,7.93,38.99378,-5.748117,Tanga,Pangani,Kipumbwi,Kipumbwi,Mkwaja,22,RN,Dagaa,Anchovy,Dagaa mchele,440,22,55.48549811,55.48549811
20/03/2020,3,NE,2020-03-20T20:30:00Z,2020-03-21T05:30:00Z,9,39.12922,-5.0876,Tanga,Tanga City,Sahare,Kasera,Kiboyani,16,RN,Sardine,Sardines,NA,100,5,11.11111111,11.11111111
20/03/2020,3,NE,2020-03-20T20:30:00Z,2020-03-21T05:30:00Z,9,39.12928,-5.0876,Tanga,Tanga City,Sahare,Kasera,Kiboyani,16,RN,Sardine,Sardines,NA,100,5,11.11111111,11.11111111
20/03/2020,3,NE,2020-03-20T21:39:00Z,2020-03-21T05:20:00Z,7.68,39.6685,-7.831,Pwani,Mafia,Chunguruma,Tumbuju,Tumbuju mfuruni,18,RN,Sardine,Sardines,NA,360,18,46.85466378,46.875
20/03/2020,3,NE,2020-03-20T21:39:00Z,2020-03-21T05:20:00Z,7.68,39.6685,-7.831,Pwani,Mafia,Chunguruma,Tumbuju,Tumbuju mfuruni,18,RN,Dagaa,Anchovy,Dagaa mchele,360,18,46.875,46.875
20/03/2020,3,NE,2020-03-20T23:55:00Z,2020-03-21T05:00:00Z,5.08,39.43513,-8.42691,Lindi,Kilwa,Somanga,Mbuyuni,Washamba,13,RN,Sardine,Sardines,NA,60,10,11.80327869,11.81102362
21/03/2020,3,NE,2020-03-21T01:00:00Z,2020-03-21T05:30:00Z,4.5,39.66341,-5.02631,Pemba,Wete,Selemu,Wete Pwani,Fundo,18,RN,Decapterus macrosoma,Mackerel,Msumari,460,23,102.2222222,102.2222222
21/03/2020,3,NE,2020-03-21T01:00:00Z,2020-03-21T05:30:00Z,4.5,39.66341,-5.02631,Pemba,Wete,Selemu,Wete Pwani,Fundo,18,RN,Decapterus macrosoma,Mackerel,Msumari,460,23,102.2222222,102.2222222
21/03/2020,3,NE,2020-03-21T01:20:00Z,2020-03-21T05:30:00Z,4.17,40.32662,-10.35322,Mtwara,Mtwara Rural,Mnazi,Mnazi Bay,FUNGUNI,8,RN,Atule mate,Mackerel,NA,100,5,24,23.98081535
21/03/2020,3,NE,2020-03-21T02:33:00Z,2020-03-21T17:33:00Z,15,39.18822,-5.501337,Unguja,Kaskazini A,Mkokotoni,Nungwi,Kibaha vhano,15,GN,Dussumieria acuta,Anchovy,Dagaa sime ( simu),160,8,10.66666667,10.66666667
21/03/2020,3,NE,2020-03-21T08:35:00Z,2020-03-21T12:23:00Z,3.8,40.37448,-10.31507,Mtwara,Mtwara Rural,Mnazi,Mnazi Bay,BWANAOGA,17,RN,Dussumieria acuta,Anchovy,NA,200,10,52.63157895,52.63157895
21/03/2020,3,NE,2020-03-21T08:50:00Z,2020-03-21T11:00:00Z,2.17,39.78641,-9.39907,Lindi,Lindi,Benki,Beach,Kilamba,17,RN,Chirocentrus dorab,Dermesal,NA,90,9,41.53846153,41.47465438
21/03/2020,3,NE,2020-03-21T08:50:00Z,2020-03-21T11:00:00Z,2.17,39.78641,-9.39909,Lindi,Lindi,Benki,Beach,Kilamba,17,RN,Rastrelliger kanagurta,Mackerel,NA,200,20,92.30769229,92.16589862
21/03/2020,3,NE,2020-03-21T18:00:00Z,2020-03-22T06:00:00Z,12,39.28675,-8.39085,Lindi,Kilwa,Somanga,Mbuyuni,Fungu mbili,15,RN,Sardine,Sardines,NA,240,12,20,20
21/03/2020,3,NE,2020-03-21T19:00:00Z,2020-03-21T22:16:00Z,3.27,39.28331,-8.39396,Lindi,Kilwa,Somanga,Mbuyuni,Washamba,13,RN,Sardine,Sardines,NA,180,10,55.10204081,55.04587156
21/03/2020,3,NE,2020-03-21T19:25:00Z,2020-03-22T00:27:00Z,5.03,38.99383,-5.751817,Tanga,Pangani,Kipumbwi,Kipumbwi,Mkwaja,22,RN,Decapterus kurroides,Mackerel,NA,200,10,39.73509934,39.76143141
21/03/2020,3,NE,2020-03-21T19:25:00Z,2020-03-22T00:27:00Z,5.03,38.99383,-5.751817,Tanga,Pangani,Kipumbwi,Kipumbwi,Mkwaja,22,RN,Etrumeus teres,Anchovy,NA,200,10,39.73509934,39.76143141
21/03/2020,3,NE,2020-03-21T19:25:00Z,2020-03-22T00:27:00Z,5.03,38.99383,-5.751817,Tanga,Pangani,Kipumbwi,Kipumbwi,Mkwaja,22,RN,Etrumeus teres,Anchovy,Uono kikwete,200,10,39.76143141,39.76143141
21/03/2020,3,NE,2020-03-21T19:25:00Z,2020-03-22T00:27:00Z,5.03,38.99383,-5.751817,Tanga,Pangani,Kipumbwi,Kipumbwi,Mkwaja,22,RN,Decapterus kurroides,Mackerel,Msumari ( ngula-ngula),200,10,39.76143141,39.76143141
21/03/2020,3,NE,2020-03-21T21:30:00Z,2020-03-22T03:41:00Z,6.18,39.34877,-4.82381,Tanga,Mkinga,Zingibari,Petukiza,Kolep,41,RN,Seriolina spp,Caranx,NA,70,7,11.32075472,11.32686084
22/03/2020,3,NE,2020-03-22T01:00:00Z,2020-03-22T06:24:00Z,5.4,39.64152,-5.07234,Pemba,Wete,Fundo,Fundo,Bahari kuu,5,SK,Katsuwonus pelamis,Tuna,NA,18,3,3.333333333,3.333333333
22/03/2020,3,NE,2020-03-22T01:00:00Z,2020-03-22T05:30:00Z,4.5,39.66341,-5.02631,Pemba,Wete,Selemu,Wete Pwani,Fundo,18,RN,Decapterus macrosoma,Mackerel,Msumari,320,16,71.11111111,71.11111111
22/03/2020,3,NE,2020-03-22T02:00:00Z,2020-03-22T05:00:00Z,3,39.34877,-4.82381,Tanga,Mkinga,Zingibari,Petukiza,Koleo,41,RN,Sphyraena putnamiae,Dermesal,NA,50,5,16.66666667,16.66666667
22/03/2020,3,NE,2020-03-22T04:00:00Z,2020-03-22T11:00:00Z,7,39.24747,-4.74743,Tanga,Mkinga,Zingibari,Petukiza,Mwezi,20,RN,Dussumieria acuta,Anchovy,NA,140,7,20,20
22/03/2020,3,NE,2020-03-22T08:49:00Z,2020-03-22T11:50:00Z,3.02,39.7822,-9.89849,Lindi,Lindi,Benki,Beach,Kikamba,18,RN,Chirocentrus dorab,Dermesal,NA,190,19,62.98342541,62.91390728
22/03/2020,3,NE,2020-03-22T08:49:00Z,2020-03-22T11:50:00Z,3.02,39.7822,-9.89849,Lindi,Lindi,Benki,Beach,Kikamba,18,RN,Dussumieria acuta,Anchovy,NA,300,30,99.4475138,99.33774834
22/03/2020,3,NE,2020-03-22T08:49:00Z,2020-03-22T11:50:00Z,3.02,39.7822,-9.89849,Lindi,Lindi,Benki,Beach,Kikamba,18,RN,Rastrelliger kanagurta,Mackerel,NA,100,10,33.14917127,33.11258278
22/03/2020,3,NE,2020-03-22T09:24:00Z,2020-03-22T12:23:00Z,2.98,40.37448,-10.31507,Mtwara,Mtwara Rural,Mnazi,Mnazi Bay,BWANAOGA,23,RN,Dussumieria acuta,Anchovy,NA,210,21,70.39106146,70.46979866
22/03/2020,3,NE,2020-03-22T09:24:00Z,2020-03-22T12:23:00Z,2.98,40.37448,-10.31507,Mtwara,Mtwara Rural,Mnazi,Mnazi Bay,BWANAOGA,23,RN,Dussumieria acuta,Anchovy,NA,210,21,70.39106146,70.46979866
22/03/2020,3,NE,2020-03-22T14:37:00Z,2020-03-22T16:37:00Z,2,39.1034,-5.45376,Unguja,Kaskazini A,Mkokotoni,Nungwi,Kiwani,15,GN,Lethrinus lentjan,Reef,Changu n'jana,300,15,150,150
22/03/2020,3,NE,2020-03-22T17:15:00Z,2020-03-23T04:30:00Z,11.25,39.12928,-5.08759,Tanga,Tanga City,Sahare,Kasera,Kiboyani,16,RN,Sardine,Sardines,NA,110,5.5,9.777777778,9.777777778
22/03/2020,3,NE,2020-03-22T18:00:00Z,2020-03-23T06:00:00Z,12,39.28675,-8.39085,Lindi,Kilwa,Somanga,Mbuyuni,Machange,15,RN,Sardine,Sardines,NA,160,8,13.33333333,13.33333333
22/03/2020,3,NE,2020-03-22T19:25:00Z,2020-03-23T02:26:00Z,7.02,38.94222,-5.908333,Tanga,Pangani,Kipumbwi,Kipumbwi,Bawe,22,RN,Dussumieria acuta,Anchovy,NA,140,20,19.95249406,19.94301994
22/03/2020,3,NE,2020-03-22T19:25:00Z,2020-03-23T02:26:00Z,7.02,38.94222,-5.908333,Tanga,Pangani,Kipumbwi,Kipumbwi,Bawe,22,RN,Rastrelliger kanagurta,Mackerel,NA,20,1,2.850356294,2.849002849
22/03/2020,3,NE,2020-03-22T19:25:00Z,2020-03-23T02:26:00Z,7.02,38.94222,-5.908333,Tanga,Pangani,Kipumbwi,Kipumbwi,Bawe,22,RN,Sardine,Sardines,NA,120,6,17.10213777,17.09401709
22/03/2020,3,NE,2020-03-22T19:25:00Z,2020-03-23T02:26:00Z,7.02,38.94222,-5.908333,Tanga,Pangani,Kipumbwi,Kipumbwi,Bawe,22,RN,Sphyraena putnamiae,Dermesal,NA,20,1,2.850356294,2.849002849
22/03/2020,3,NE,2020-03-22T19:25:00Z,2020-03-23T02:26:00Z,7.02,38.94222,-5.908333,Tanga,Pangani,Kipumbwi,Kipumbwi,Bawe,22,RN,Dussumieria acuta,Anchovy,Dagaa sime ( simu),140,20,19.94301994,19.94301994
22/03/2020,3,NE,2020-03-22T19:25:00Z,2020-03-23T02:26:00Z,7.02,38.94222,-5.908333,Tanga,Pangani,Kipumbwi,Kipumbwi,Bawe,22,RN,Dagaa,Anchovy,Dagaa mchele,120,6,17.09401709,17.09401709
22/03/2020,3,NE,2020-03-22T19:25:00Z,2020-03-23T02:26:00Z,7.02,38.94222,-5.908333,Tanga,Pangani,Kipumbwi,Kipumbwi,Bawe,22,RN,Rastrelliger kanagurta,Mackerel,Kibua maji,20,1,2.849002849,2.849002849
22/03/2020,3,NE,2020-03-22T19:25:00Z,2020-03-23T02:26:00Z,7.02,38.94222,-5.908333,Tanga,Pangani,Kipumbwi,Kipumbwi,Bawe,22,RN,Sphyraena putnamiae,Dermesal,Msusa,20,1,2.849002849,2.849002849
23/03/2020,3,NE,2020-03-23T00:00:00Z,2020-03-23T05:15:00Z,5.25,40.3266,-10.35323,Mtwara,Mtwara Rural,Mnazi,Mnazi Bay,CHUMBU,9,RN,Dussumieria acuta,Anchovy,NA,60,3,11.42857143,11.42857143
23/03/2020,3,NE,2020-03-23T00:00:00Z,2020-03-23T05:15:00Z,5.25,40.3266,-10.35323,Mtwara,Mtwara Rural,Mnazi,Mnazi Bay,CHUMBU,9,RN,Dussumieria acuta,Anchovy,NA,60,3,11.42857143,11.42857143
23/03/2020,3,NE,2020-03-23T00:00:00Z,2020-03-23T05:15:00Z,5.25,40.3266,-10.35323,Mtwara,Mtwara Rural,Mnazi,Mnazi Bay,CHUMBU,9,RN,Dussumieria acuta,Anchovy,NA,180,3,34.28571429,34.28571429
23/03/2020,3,NE,2020-03-23T01:00:00Z,2020-03-23T06:00:00Z,5,39.64315,-5.73341,Pemba,Wete,Fundo,Fundo,Bahari kuu,5,SK,Katsuwonus pelamis,Tuna,NA,27,8,5.4,5.4
23/03/2020,3,NE,2020-03-23T05:30:00Z,2020-03-23T08:46:00Z,3.27,39.2568,-6.7096,Dar es Salaam,Kinondoni,Kunduchi Pwani,Kunduchi Pwani,Karage,56,RN,Stolephorus devisi,Anchovy,NA,320,16,97.95918366,97.85932722
23/03/2020,3,NE,2020-03-23T07:30:00Z,2020-03-23T12:39:00Z,5.15,39.22713,-4.736546,Tanga,Mkinga,Zingibari,Petukiza,Funguni,19,RN,Dussumieria acuta,Anchovy,NA,100,5,19.41747573,19.41747573
23/03/2020,3,NE,2020-03-23T15:41:00Z,2020-03-23T16:42:00Z,1.02,39.17838,-5.73013,Unguja,Kaskazini A,Mkokotoni,Nungwi,Kibler chano,14,GN,Hemiramphus spp,Others,Chuchunge,340,17,333.3333333,333.3333333
23/03/2020,3,NE,2020-03-23T18:00:00Z,2020-03-24T06:00:00Z,12,39.28671,-8.38086,Lindi,Kilwa,Somanga,Mbuyuni,Machange,15,RN,Sardine,Sardines,NA,406,23,33.83333333,33.83333333
23/03/2020,3,NE,2020-03-23T19:00:00Z,2020-03-24T05:30:00Z,10.5,39.71236,-4.80795,Pemba,Wete,Selemu,Wete Pwani,Kundeni,18,RN,Rastrelliger kanagurta,Mackerel,Kibua maji,240,12,22.85714286,22.85714286
23/03/2020,3,NE,2020-03-23T20:30:00Z,2020-03-24T05:00:00Z,8.5,39.12927,-5.0876,Tanga,Tanga City,Sahare,Kasera,Kwasoka,16,RN,Sardine,Sardines,NA,40,2,4.705882353,4.705882353
24/03/2020,3,NE,2020-03-24T00:30:00Z,2020-03-24T05:30:00Z,5,40.37804,-10.34516,Mtwara,Mtwara Rural,Mnazi,Mnazi Bay,KIWALE,9,RN,Dussumieria acuta,Anchovy,NA,160,8,32,32
24/03/2020,3,NE,2020-03-24T02:00:00Z,2020-03-24T05:30:00Z,3.5,39.21227,-4.78905,Tanga,Mkinga,Zingibari,Petukiza,Bunju,15,RN,Rastrelliger kanagurta,Mackerel,NA,10,7,2.857142857,2.857142857
24/03/2020,3,NE,2020-03-24T02:00:00Z,2020-03-24T05:00:00Z,3,39.43666,-8.4291,Lindi,Kilwa,Somanga,Mbuyuni,Washamba,8,RN,Sardine,Sardines,NA,126,7,42,42
24/03/2020,3,NE,2020-03-24T04:17:00Z,2020-03-24T11:18:00Z,7.02,39.1064,-5.43378,Unguja,Kaskazini A,Mkokotoni,Nungwi,Kwamwana,15,GN,Mackerel(scomber),Mackerel,Kibua,460,23,65.52706553,65.52706553
24/03/2020,3,NE,2020-03-24T06:29:00Z,2020-03-24T12:20:00Z,5.85,40.37191,-10.33126,Mtwara,Mtwara Rural,Mnazi,Mnazi Bay,CHUMBU YA TENGA,19,RN,Dussumieria acuta,Anchovy,NA,240,24,41.02564103,41.02564103
24/03/2020,3,NE,2020-03-24T07:00:00Z,2020-03-24T10:00:00Z,3,39.17617,-6.45545,Dar es Salaam,Kigamboni,Minazi  Mikinda,Minazi Mikinda,Kokobichi,34,RN,Sardine,Sardines,NA,80,4,26.66666667,26.66666667
24/03/2020,3,NE,2020-03-24T07:08:00Z,2020-03-24T12:45:00Z,5.62,39.48956,-8.35987,Lindi,Kilwa,Somanga,Mbuyuni,Kitutia,17,RN,Caranx tille,Caranx,NA,96,8,17.09198813,17.08185053
24/03/2020,3,NE,2020-03-24T07:30:00Z,2020-03-24T14:30:00Z,7,39.52774,-8.40823,Lindi,Kilwa,Somanga,Mbuyuni,Kamba jeupe,15,RN,Caranx tille,Caranx,NA,121,11,17.28571429,17.28571429
24/03/2020,3,NE,2020-03-24T08:00:00Z,2020-03-24T11:00:00Z,3,39.23151,-4.73846,Tanga,Mkinga,Zingibari,Petukiza,Mwan,18,RN,Dussumieria acuta,Anchovy,NA,60,3,20,20
24/03/2020,3,NE,2020-03-24T11:53:00Z,2020-03-24T12:42:00Z,0.82,39.15805,-4.78487,Tanga,Mkinga,Zingibari,Petukiza,Kisima,14,RN,Sardine,Sardines,NA,80,4,97.95918363,97.56097561
24/03/2020,3,NE,2020-03-24T19:00:00Z,2020-03-25T05:30:00Z,10.5,39.71236,-4.80795,Pemba,Wete,Selemu,Wete Pwani,Kundeni,18,RN,Rastrelliger kanagurta,Mackerel,Kibua maji,220,11,20.95238095,20.95238095
24/03/2020,3,NE,2020-03-24T19:05:00Z,2020-03-24T23:06:00Z,4.02,39.1064,-5.43348,Unguja,Kaskazini A,Mkokotoni,Nungwi,Kwamwana,15,GN,Mackerel(scomber),Mackerel,Kibua,460,23,114.4278607,114.4278607
24/03/2020,3,NE,2020-03-24T20:45:00Z,2020-03-25T05:15:00Z,8.5,39.12428,-5.0376,Tanga,Tanga City,Sahare,Kasera,Kiyani,16,RN,Dussumieria acuta,Anchovy,NA,60,3,7.058823529,7.058823529
24/03/2020,3,NE,2020-03-24T21:46:00Z,2020-03-25T05:20:00Z,7.57,39.6684,-7.85166,Pwani,Mafia,Chunguruma,Tumbuju,Kijambani,18,RN,Dagaa,Anchovy,Dagaa mchele,4608,64,608.7186262,608.7186262
25/03/2020,3,NE,2020-03-25T01:02:00Z,2020-03-25T05:40:00Z,4.63,40.32665,-10.35326,Mtwara,Mtwara Rural,Mnazi,Mnazi Bay,DUVI,9,RN,Dussumieria acuta,Anchovy,NA,100,5,21.58273381,21.59827214
25/03/2020,3,NE,2020-03-25T02:30:00Z,2020-03-25T14:30:00Z,12,39.21069,-4.78479,Tanga,Mkinga,Zingibari,Petukiza,Mwani,18,RN,Acanthurus spp,Reef,NA,10,6,0.833333333,0.833333333
25/03/2020,3,NE,2020-03-25T03:00:00Z,2020-03-25T06:26:00Z,3.43,39.20105,-4.89371,Tanga,Mkinga,Zingibari,Petukiza,Funguni,41,RN,Dussumieria acuta,Anchovy,NA,30,3,8.737864079,8.746355685
25/03/2020,3,NE,2020-03-25T06:30:00Z,2020-03-25T13:30:00Z,7,39.46066,-8.41538,Lindi,Kilwa,Somanga,Mbuyuni,Makatoni,15,RN,Sphyraena putnamiae,Dermesal,NA,36,3,5.142857143,5.142857143
25/03/2020,3,NE,2020-03-25T07:24:00Z,2020-03-25T10:43:00Z,3.32,40.40083,-10.34656,Mtwara,Mtwara Rural,Mnazi,Mnazi Bay,MLAMBA,21,RN,Caranx tille,Caranx,NA,375,1100,113.0653266,112.9518072
25/03/2020,3,NE,2020-03-25T08:15:00Z,2020-03-25T12:50:00Z,4.58,40.32736,-10.31668,Mtwara,Mtwara Rural,Mnazi,Mnazi Bay,MAKONGWA,15,RN,Dussumieria acuta,Anchovy,NA,NA,NA,0,NA
25/03/2020,3,NE,2020-03-25T08:30:00Z,2020-03-25T11:23:00Z,2.88,38.97185,-6.36345,Pwani,Bagamoyo,Mwambao,Kastam(Custom),Mshingwi,30,RN,Decapterus kurroides,Mackerel,NA,120,6,41.61849711,41.66666667
25/03/2020,3,NE,2020-03-25T19:00:00Z,2020-03-26T05:30:00Z,10.5,39.71236,-4.80795,Pemba,Wete,Selemu,Wete Pwani,Kundeni,18,RN,Rastrelliger kanagurta,Mackerel,Kibua maji,260,13,24.76190476,24.76190476
25/03/2020,3,NE,2020-03-25T20:30:00Z,2020-03-26T05:30:00Z,9,39.12928,-5.08758,Tanga,Tanga City,Sahare,Kasera,Kasoka,16,RN,Sardine,Sardines,NA,70,3.5,7.777777778,7.777777778
26/03/2020,3,NE,2020-03-26T01:02:00Z,2020-03-26T05:40:00Z,4.63,40.34712,-10.34275,Mtwara,Mtwara Rural,Mnazi,Mnazi Bay,CHUMBU,10,RN,Decapterus russelli,Mackerel,NA,80,4,17.26618705,17.27861771
26/03/2020,3,NE,2020-03-26T01:02:00Z,2020-03-26T05:40:00Z,4.63,40.34712,-10.34275,Mtwara,Mtwara Rural,Mnazi,Mnazi Bay,CHUMBU,10,RN,Decapterus russelli,Mackerel,NA,80,4,17.26618705,17.27861771
26/03/2020,3,NE,2020-03-26T05:11:00Z,2020-03-26T10:30:00Z,5.32,39.71929,-5.7256,Unguja,Kaskazini A,Mkokotoni,Nungwi,Kwamwana chini,15,GN,Mackerel(scomber),Mackerel,Kibua,500,25,93.98496241,93.98496241
26/03/2020,3,NE,2020-03-26T05:45:00Z,2020-03-26T09:29:00Z,3.73,39.25188,-6.69259,Dar es Salaam,Kinondoni,Kunduchi Pwani,Kunduchi Pwani,Kiromoni,49,RN,Sardine,Sardines,NA,120,11,32.14285715,32.17158177
26/03/2020,3,NE,2020-03-26T06:30:00Z,2020-03-26T07:46:00Z,1.27,39.17929,-5.7256,Unguja,Kaskazini A,Mkokotoni,Nungwi,Kwamwana,15,GN,Mackerel(scomber),Mackerel,Kibua,500,25,393.7007874,393.7007874
26/03/2020,3,NE,2020-03-26T07:30:00Z,2020-03-26T10:00:00Z,2.5,39.17632,-6.45618,Dar es Salaam,Kigamboni,Minazi  Mikinda,Minazi Mikinda,Kokobichi,35,RN,Sardine,Sardines,NA,240,12,96,96
26/03/2020,3,NE,2020-03-26T08:45:00Z,2020-03-26T11:05:00Z,2.33,39.0507,-6.35572,Pwani,Bagamoyo,Mwambao,Kastam(Custom),Boribo,30,RN,Sphyraena putnamiae,Dermesal,NA,120,6,51.42857144,51.50214592
26/03/2020,3,NE,2020-03-26T19:00:00Z,2020-03-27T05:30:00Z,10.5,39.71236,-4.80795,Pemba,Wete,Selemu,Wete Pwani,Kundeni,18,RN,Rastrelliger kanagurta,Mackerel,Kibua maji,200,10,19.04761905,19.04761905
26/03/2020,3,NE,2020-03-26T20:20:00Z,2020-03-27T04:45:00Z,8.42,39.16316,-6.27433,Dar es Salaam,Kinondoni,Kunduchi Pwani,Kunduchi Pwani,Karage,22,RN,Sardine,Sardines,NA,800,40,95.04950495,95.01187648
27/03/2020,3,NE,2020-03-27T00:00:00Z,2020-03-27T06:30:00Z,6.5,40.34214,-10.30211,Mtwara,Mtwara Rural,Mnazi,Mnazi Bay,MATENGA,9,RN,Atule mate,Mackerel,NA,80,4,12.30769231,12.30769231
27/03/2020,3,NE,2020-03-27T00:00:00Z,2020-03-27T06:30:00Z,6.5,40.34214,-10.30211,Mtwara,Mtwara Rural,Mnazi,Mnazi Bay,MATENGA,9,RN,Atule mate,Mackerel,NA,80,4,12.30769231,12.30769231
27/03/2020,3,NE,2020-03-27T01:00:00Z,2020-03-27T06:00:00Z,5,39.64336,-5.07578,Pemba,Wete,Fundo,Fundo,Bahari kuu,5,SK,Katsuwonus pelamis,Tuna,NA,73,13,14.6,14.6
27/03/2020,3,NE,2020-03-27T05:29:00Z,2020-03-27T08:40:00Z,3.18,39.52085,-6.71008,Dar es Salaam,Kinondoni,Kunduchi Pwani,Kunduchi Pwani,Kiromoni,49,RN,Sardine,Sardines,NA,680,34,213.6125655,213.836478
27/03/2020,3,NE,2020-03-27T05:44:00Z,2020-03-27T09:10:00Z,3.43,39.24115,-6.6841,Dar es Salaam,Kinondoni,Kunduchi Pwani,Kunduchi Pwani,Bongoyo,54,RN,Sardine,Sardines,NA,180,9,52.42718447,52.47813411
27/03/2020,3,NE,2020-03-27T05:45:00Z,2020-03-27T08:30:00Z,2.75,39.25111,-6.69164,Dar es Salaam,Kinondoni,Kunduchi Pwani,Kunduchi Pwani,Panganne,52,RN,Sardine,Sardines,NA,200,20,72.72727273,72.72727273
27/03/2020,3,NE,2020-03-27T07:23:00Z,2020-03-27T12:14:00Z,4.85,40.37448,-10.31507,Mtwara,Mtwara Rural,Mnazi,Mnazi Bay,CHUMBU,22,RN,Dussumieria acuta,Anchovy,NA,50,5,10.30927835,10.30927835
27/03/2020,3,NE,2020-03-27T07:30:00Z,2020-03-27T14:00:00Z,6.5,39.28227,-8.3973,Lindi,Kilwa,Somanga,Mbuyuni,Pwayasi,14,RN,Thunnus tonggol,Tuna,NA,81,9,12.46153846,12.46153846
27/03/2020,3,NE,2020-03-27T08:38:00Z,2020-03-27T11:10:00Z,2.53,39.15805,-4.78486,Tanga,Mkinga,Zingibari,Petukiza,Kwsmzungu,20,RN,Sardine,Sardines,NA,300,15,118.4210526,118.5770751
27/03/2020,3,NE,2020-03-27T16:10:00Z,2020-03-28T06:10:00Z,14,39.17929,-5.4256,Unguja,Kaskazini A,Mkokotoni,Nungwi,Kwamwana  chini,15,GN,Mackerel(scomber),Mackerel,Kibua,800,40,57.14285714,57.14285714
27/03/2020,3,NE,2020-03-27T18:00:00Z,2020-03-28T06:00:00Z,12,39.28675,-8.39089,Lindi,Kilwa,Somanga,Mbuyuni,Machange,15,RN,Sardine,Sardines,NA,1100,55,91.66666667,91.66666667
27/03/2020,3,NE,2020-03-27T19:00:00Z,2020-03-28T05:30:00Z,10.5,39.71236,-4.80795,Pemba,Wete,Selemu,Wete Pwani,Kundeni,18,RN,Rastrelliger kanagurta,Mackerel,Kibua maji,240,12,22.85714286,22.85714286
28/03/2020,3,NE,2020-03-28T02:00:00Z,2020-03-28T05:45:00Z,3.75,39.34877,-4.82381,Tanga,Mkinga,Zingibari,Petukiza,Koleo,41,RN,Acanthurus spp,Reef,NA,100,10,26.66666667,26.66666667
28/03/2020,3,NE,2020-03-28T05:45:00Z,2020-03-28T08:30:00Z,2.75,39.23857,-6.69092,Dar es Salaam,Kinondoni,Kunduchi Pwani,Kunduchi Pwani,Bongoyo,60,RN,Sardine,Sardines,NA,320,16,116.3636364,116.3636364
28/03/2020,3,NE,2020-03-28T07:00:00Z,2020-03-28T10:00:00Z,3,39.22413,-4.74185,Tanga,Mkinga,Zingibari,Petukiza,Minyaka,22,RN,Dussumieria acuta,Anchovy,NA,100,5,33.33333333,33.33333333
28/03/2020,3,NE,2020-03-28T07:00:00Z,2020-03-28T10:00:00Z,3,39.19695,-6.52838,Dar es Salaam,Kigamboni,Minazi  Mikinda,Minazi Mikinda,Ustabei,30,RN,Sardine,Sardines,NA,300,15,100,100
28/03/2020,3,NE,2020-03-28T07:43:00Z,2020-03-28T12:33:00Z,4.83,40.37191,-10.33126,Mtwara,Mtwara Rural,Mnazi,Mnazi Bay,CHUMBU YA TENGA,17,RN,Dussumieria acuta,Anchovy,NA,40,4,8.27586207,8.281573499
28/03/2020,3,NE,2020-03-28T07:47:00Z,2020-03-28T10:17:00Z,2.5,39.15808,-4.78489,Tanga,Mkinga,Zingibari,Petukiza,Milangoni,21,RN,Sardine,Sardines,NA,40,2,16,16
28/03/2020,3,NE,2020-03-28T08:01:00Z,2020-03-28T11:00:00Z,2.98,39.27147,-4.8224,Tanga,Mkinga,Zingibari,Petukiza,Kwamzungu,19,RN,Dussumieria acuta,Anchovy,NA,60,3,20.11173185,20.13422819
28/03/2020,3,NE,2020-03-28T08:30:00Z,2020-03-28T11:17:00Z,2.78,39.11678,-6.41189,Pwani,Bagamoyo,Mwambao,Kastam(Custom),Changohela,29,RN,Sphyraena putnamiae,Dermesal,NA,120,6,43.11377246,43.16546763
28/03/2020,3,NE,2020-03-28T16:19:00Z,2020-03-28T23:20:00Z,7.02,39.17929,-5.7256,Unguja,Kaskazini A,Mkokotoni,Nungwi,Kwamwana chini,15,GN,Mackerel(scomber),Mackerel,Kibua,160,8,22.79202279,22.79202279
28/03/2020,3,NE,2020-03-28T18:00:00Z,2020-03-29T06:00:00Z,12,39.28675,-8.39086,Lindi,Kilwa,Somanga,Mbuyuni,Fungu mbili,15,RN,Sardine,Sardines,NA,760,20,63.33333333,63.33333333
28/03/2020,3,NE,2020-03-28T19:00:00Z,2020-03-29T05:30:00Z,10.5,39.71236,-4.80795,Pemba,Wete,Selemu,Wete Pwani,Kundeni,18,RN,Rastrelliger kanagurta,Mackerel,Kibua maji,220,11,20.95238095,20.95238095
29/03/2020,3,NE,2020-03-29T01:00:00Z,2020-03-29T05:45:00Z,4.75,39.34877,-4.82381,Tanga,Mkinga,Zingibari,Petukiza,Koleo,41,RN,Dussumieria acuta,Anchovy,NA,150,15,31.57894737,31.57894737
29/03/2020,3,NE,2020-03-29T06:00:00Z,2020-03-30T05:00:00Z,23,39.64326,-5.72543,Pemba,Wete,Fundo,Fundo,Bahari kuu,6,SK,Katsuwonus pelamis,Tuna,NA,11,3,0.47826087,0.47826087
29/03/2020,3,NE,2020-03-29T08:00:00Z,2020-03-29T13:30:00Z,5.5,39.27548,-8.23543,Lindi,Kilwa,Somanga,Mbuyuni,Mziwaji,14,RN,Rastrelliger kanagurta,Mackerel,NA,60,5,10.90909091,10.90909091
29/03/2020,3,NE,2020-03-29T08:12:00Z,2020-03-29T14:03:00Z,5.85,40.37448,-10.31507,Mtwara,Mtwara Rural,Mnazi,Mnazi Bay,BWANAOGA,22,RN,Dussumieria acuta,Anchovy,NA,120,12,20.51282051,20.51282051
29/03/2020,3,NE,2020-03-29T08:28:00Z,2020-03-29T11:31:00Z,3.05,39.15806,-4.78489,Tanga,Mkinga,Zingibari,Petukiza,K wamzungu,20,RN,Stolephorus commersonii,Anchovy,NA,80,4,26.2295082,26.2295082
29/03/2020,3,NE,2020-03-29T14:26:00Z,2020-03-30T03:27:00Z,13.02,39.14209,-5.89713,Unguja,Kaskazini A,Mkokotoni,Nungwi,MachuÃ±ngwa,15,GN,Gayogayo,Dermesal,Gayogayo,NA,NA,NA,NA
29/03/2020,3,NE,2020-03-29T17:30:00Z,2020-03-30T05:15:00Z,11.75,39.43709,-8.43122,Lindi,Kilwa,Somanga,Mbuyuni,Mashamba,12,RN,Sardine,Sardines,NA,180,10,15.31914894,15.31914894
29/03/2020,3,NE,2020-03-29T18:17:00Z,2020-03-29T18:17:00Z,0,39.01925,-5.66775,Tanga,Pangani,Kipumbwi,Kipumbwi,Mijimile,22,RN,Etrumeus teres,Anchovy,NA,240,12,Inf,Inf
29/03/2020,3,NE,2020-03-29T18:17:00Z,2020-03-30T06:17:00Z,12,39.01925,-5.66775,Tanga,Pangani,Kipumbwi,Kipumbwi,Mijimile,22,RN,Etrumeus teres,Anchovy,Uono kikwete,240,12,20,20
29/03/2020,3,NE,2020-03-29T19:20:00Z,2020-03-30T04:20:00Z,9,39.72082,-7.78577,Pwani,Mafia,Chunguruma,Tumbuju,Bichi,20,RN,Dagaa,Anchovy,Dagaa mchele,400,20,44.44444444,44.44444444
29/03/2020,3,NE,2020-03-29T19:30:00Z,2020-03-30T05:35:00Z,10.08,39.72085,-7.78577,Pwani,Mafia,Chunguruma,Tumbuju,Bukini,20,RN,Dagaa,Anchovy,Dagaa mchele,400,20,39.68253968,39.68253968
30/03/2020,3,NE,2020-03-30T01:00:00Z,2020-03-30T06:25:00Z,5.42,39.64345,-5.73513,Pemba,Wete,Fundo,Fundo,Bahari kuu,5,SK,Xiphiasgladius spp,Tuna,NA,37,1,6.83076923,6.826568266
30/03/2020,3,NE,2020-03-30T01:31:00Z,2020-03-30T08:29:00Z,6.97,39.17929,-5.7256,Unguja,Kaskazini A,Mkokotoni,Nungwi,Kwamwana chini,16,GN,Mackerel(scomber),Mackerel,Kibua,40,2,5.738880918,5.738880918
30/03/2020,3,NE,2020-03-30T07:30:00Z,2020-03-31T14:11:00Z,30.68,39.46066,-8.41538,Lindi,Kilwa,Somanga,Mbuyuni,Ukuza,14,RN,Auxis thazard,Tuna,NA,72,6,2.346550788,2.346805737
30/03/2020,3,NE,2020-03-30T08:34:00Z,2020-03-30T14:15:00Z,5.68,39.03112,-6.40435,Pwani,Bagamoyo,Mwambao,Kastam(Custom),Changohela,23,RN,Decapterus kurroides,Mackerel,NA,NA,NA,0,NA
30/03/2020,3,NE,2020-03-30T08:37:00Z,2020-03-30T14:35:00Z,5.97,40.34677,-10.34314,Mtwara,Mtwara Rural,Mnazi,Mnazi Bay,BWANAOGA,20,RN,Sphyraena barracuda,Dermesal,NA,100,10,16.75977654,16.75041876
30/03/2020,3,NE,2020-03-30T18:00:00Z,2020-03-31T06:00:00Z,12,39.28672,-8.39087,Lindi,Kilwa,Somanga,Mbuyuni,Machange,15,RN,Sardine,Sardines,NA,300,12,25,25
30/03/2020,3,NE,2020-03-30T18:44:00Z,2020-03-31T04:52:00Z,10.13,39.393,-5.673217,Tanga,Pangani,Kipumbwi,Kipumbwi,Mijimile,22,RN,Etrumeus teres,Anchovy,NA,460,23,45.39473686,45.40967423
30/03/2020,3,NE,2020-03-30T18:44:00Z,2020-03-31T04:52:00Z,10.13,39.393,-5.673217,Tanga,Pangani,Kipumbwi,Kipumbwi,Mijimile,22,RN,Etrumeus teres,Anchovy,Uono kikwete,460,23,45.40967423,45.40967423
31/03/2020,3,NE,2020-03-31T07:46:00Z,2020-03-31T08:54:00Z,1.13,40.34677,-10.34314,Mtwara,Mtwara Rural,Mnazi,Mnazi Bay,SADIKI,17,RN,Caranx tille,Caranx,NA,500,50,441.1764707,442.4778761
31/03/2020,3,NE,2020-03-31T07:46:00Z,2020-03-31T08:54:00Z,1.13,40.34677,-10.34314,Mtwara,Mtwara Rural,Mnazi,Mnazi Bay,SADIKI,17,RN,Caranx tille,Caranx,NA,500,100,441.1764707,442.4778761
31/03/2020,3,NE,2020-03-31T17:40:00Z,2020-04-01T06:41:00Z,13.02,39.02624,-5.85482,Unguja,Kaskazini A,Mkokotoni,Nungwi,Mkwaja,15,GN,Dussumieria acuta,Anchovy,Dagaa sime ( simu),180,9,13.82488479,13.82488479
31/03/2020,3,NE,2020-03-31T18:25:00Z,2020-04-01T04:27:00Z,10.03,39.03843,-5.674133,Tanga,Pangani,Kipumbwi,Kipumbwi,Mijimile,22,RN,Etrumeus teres,Anchovy,NA,440,22,43.85382061,43.86839482
31/03/2020,3,NE,2020-03-31T18:25:00Z,2020-04-01T04:27:00Z,10.03,39.03843,-5.674133,Tanga,Pangani,Kipumbwi,Kipumbwi,Mijimile,22,RN,Etrumeus teres,Anchovy,Uono kikwete,440,22,43.86839482,43.86839482
31/03/2020,3,NE,2020-03-31T19:30:00Z,2020-04-01T06:00:00Z,10.5,39.66211,-5.32115,Pemba,Pemba Kusini,Mbuyuni,Ngazini,Wambaa,16,RN,Atule mate,Mackerel,NA,60,3,5.714285714,5.714285714
31/03/2020,3,NE,2020-03-31T19:30:00Z,2020-04-01T06:00:00Z,10.5,39.66211,-5.32115,Pemba,Pemba Kusini,Mbuyuni,Ngazini,Wambaa,16,RN,Loligo spp,Others,NA,80,4,7.619047619,7.619047619
31/03/2020,3,NE,2020-03-31T20:15:00Z,2020-04-01T05:15:00Z,9,39.12928,-5.08759,Tanga,Tanga City,Sahare,Kasera,Kiboyani,16,RN,Dussumieria acuta,Anchovy,NA,80,4,8.888888889,8.888888889
01/04/2020,4,IN,2020-04-01T06:30:00Z,2020-04-01T10:25:00Z,3.92,39.24027,-6.30317,Dar es Salaam,Kinondoni,Kunduchi Pwani,Kunduchi Pwani,Pungume,26,RN,Sardine,Sardines,NA,200,10,51.06382978,51.02040816
01/04/2020,4,IN,2020-04-01T07:57:00Z,2020-04-01T11:43:00Z,3.77,40.346773,-10.34314,Mtwara,Mtwara Rural,Mnazi,Mnazi Bay,SADIKI,14,RN,Coryphaena ssp,Tuna,NA,NA,NA,0,NA
01/04/2020,4,IN,2020-04-01T08:15:00Z,2020-04-01T12:05:00Z,3.83,40.3392,-10.33543,Mtwara,Mtwara Rural,Mnazi,Mnazi Bay,HALFANI,19,RN,Coryphaena ssp,Tuna,NA,200,10,52.17391305,52.21932115
01/04/2020,4,IN,2020-04-01T08:15:00Z,2020-04-01T12:05:00Z,3.83,40.3392,-10.33543,Mtwara,Mtwara Rural,Mnazi,Mnazi Bay,HALFANI,19,RN,Coryphaena ssp,Tuna,NA,200,10,52.17391305,52.21932115
01/04/2020,4,IN,2020-04-01T10:48:00Z,2020-04-01T12:48:00Z,2,39.27837,-5.69125,Unguja,Kaskazini A,Mkokotoni,Nungwi,Mnarani,16,GN,Mackerel(scomber),Mackerel,Kibua,140,7,70,70
01/04/2020,4,IN,2020-04-01T18:15:00Z,2020-04-02T04:32:00Z,10.28,39.04068,-5.673583,Tanga,Pangani,Kipumbwi,Kipumbwi,Mijimile,22,RN,Etrumeus teres,Anchovy,NA,20,1,1.944894652,1.945525292
01/04/2020,4,IN,2020-04-01T18:15:00Z,2020-04-02T04:32:00Z,10.28,39.04068,-5.673583,Tanga,Pangani,Kipumbwi,Kipumbwi,Mijimile,22,RN,Etrumeus teres,Anchovy,Uono kikwete,20,1,1.945525292,1.945525292
01/04/2020,4,IN,2020-04-01T19:00:00Z,2020-04-02T06:00:00Z,11,39.66211,-5.32112,Pemba,Pemba Kusini,Mbuyuni,Ngazini,Wambaa,16,RN,Atule mate,Mackerel,NA,80,4,7.272727273,7.272727273
01/04/2020,4,IN,2020-04-01T19:00:00Z,2020-04-02T06:00:00Z,11,39.66211,-5.32115,Pemba,Pemba Kusini,Mbuyuni,Ngazini,Wambaa,16,RN,Loligo spp,Others,NA,20,1,1.818181818,1.818181818
01/04/2020,4,IN,2020-04-01T21:09:00Z,2020-04-02T08:09:00Z,11,39.68191667,-7.836233333,Pwani,Mafia,Kilindoni,Kilindoni,Mfuluni,17,RN,Sardine,Sardines,NA,40,2,3.636363636,3.636363636
01/04/2020,4,IN,2020-04-01T21:20:00Z,2020-04-02T06:03:00Z,8.72,39.61023333,-7.908333333,Pwani,Mafia,Kilindoni,Kilindoni,Mfuluni,17,RN,Sardine,Sardines,NA,500,25,57.36137667,57.33944954
01/04/2020,4,IN,2020-04-01T21:20:00Z,2020-04-02T06:03:00Z,8.72,39.36614,-7.545,Pwani,Mafia,Kilindoni,Kilindoni,Mfuluni,17,RN,Dagaa,Anchovy,Dagaa mchele,500,25,57.33944954,57.33944954
02/04/2020,4,IN,2020-04-02T07:52:00Z,2020-04-02T13:36:00Z,5.73,40.40083,-10.34656,Mtwara,Mtwara Rural,Mnazi,Mnazi Bay,MLAMBA,14,RN,Caranx tille,Caranx,NA,256,32,44.65116279,44.67713787
02/04/2020,4,IN,2020-04-02T08:14:00Z,2020-04-02T12:05:00Z,3.85,40.3392,-10.33543,Mtwara,Mtwara Rural,Mnazi,Mnazi Bay,HALFANI,19,RN,Coryphaena ssp,Tuna,NA,200,10,51.94805195,51.94805195
02/04/2020,4,IN,2020-04-02T18:12:00Z,2020-04-03T00:12:00Z,6,39.17567,-5.80552,Unguja,Kaskazini A,Mkokotoni,Nungwi,Milamgo  ya meli,15,GN,Dussumieria acuta,Anchovy,Dagaa sime ( simu),120,6,20,20
02/04/2020,4,IN,2020-04-02T19:10:00Z,2020-04-03T04:50:00Z,9.67,39.64441,-7.7711,Pwani,Mafia,Chunguruma,Tumbuju,Ali jiji,20,RN,Dagaa,Anchovy,Dagaa mchele,800,40,82.73009307,82.73009307
02/04/2020,4,IN,2020-04-02T19:30:00Z,2020-04-03T05:30:00Z,10,39.66764,-5.31253,Pemba,Pemba Kusini,Mbuyuni,Ngazini,Rasini,16,RN,Atule mate,Mackerel,NA,80,4,8,8
03/04/2020,4,IN,2020-04-03T03:18:00Z,2020-04-03T10:18:00Z,7,39.18871,-5.71321,Unguja,Kaskazini A,Mkokotoni,Nungwi,Nungwi,23,GN,Mackerel(scomber),Mackerel,Kibua,600,30,85.71428571,85.71428571
03/04/2020,4,IN,2020-04-03T07:00:00Z,2020-04-03T10:00:00Z,3,39.31244,-6.78394,Dar es Salaam,Kigamboni,Minazi  Mikinda,Minazi Mikinda,Boyani,35,RN,Sardine,Sardines,NA,160,8,53.33333333,53.33333333
03/04/2020,4,IN,2020-04-03T08:44:00Z,2020-04-03T13:15:00Z,4.52,40.39243,-10.27424,Mtwara,Mtwara Rural,Mnazi,Mnazi Bay,RASI YA MOA,16,RN,Sphyraena barracuda,Dermesal,NA,20,2,4.42804428,4.424778761
03/04/2020,4,IN,2020-04-03T08:44:00Z,2020-04-03T13:15:00Z,4.52,40.39243,-10.27424,Mtwara,Mtwara Rural,Mnazi,Mnazi Bay,RASI YA MOA,16,RN,Sphyraena barracuda,Dermesal,NA,20,2,4.42804428,4.424778761
03/04/2020,4,IN,2020-04-03T11:15:00Z,2020-04-03T12:30:00Z,1.25,39.34877,-4.82381,Tanga,Mkinga,Zingibari,Petukiza,Kioleo,28,RN,Caranx tille,Caranx,NA,100,10,80,80
03/04/2020,4,IN,2020-04-03T19:45:00Z,2020-04-04T06:15:00Z,10.5,39.61023333,-7.908333333,Pwani,Mafia,Kilindoni,Kilindoni,Fungu Ngombe,17,RN,Sardine,Sardines,NA,800,40,76.19047619,76.19047619
03/04/2020,4,IN,2020-04-03T19:45:00Z,2020-04-04T06:15:00Z,10.5,39.36614,-5.07545,Pwani,Mafia,Kilindoni,Kilindoni,Fungu Ngombe,17,RN,Dagaa,Anchovy,Dagaa mchele,800,40,76.19047619,76.19047619
04/04/2020,4,IN,2020-04-04T05:00:00Z,2020-04-04T06:00:00Z,1,39.24747,-4.74743,Tanga,Mkinga,Zingibari,Petukiza,Kwamzungu,14,RN,Dussumieria acuta,Anchovy,NA,80,4,80,80
04/04/2020,4,IN,2020-04-04T08:30:00Z,2020-04-04T09:55:00Z,1.42,40.34434,-10.28078,Mtwara,Mtwara Rural,Mnazi,Mnazi Bay,KIPWA,17,RN,Sardine,Sardines,NA,100,5,70.58823528,70.42253521
04/04/2020,4,IN,2020-04-04T08:42:00Z,2020-04-04T12:37:00Z,3.92,40.39243,-10.27424,Mtwara,Mtwara Rural,Mnazi,Mnazi Bay,RASI YA MOA,19,RN,Dussumieria acuta,Anchovy,NA,170,17,43.40425532,43.36734694
04/04/2020,4,IN,2020-04-04T19:20:00Z,2020-04-05T06:50:00Z,11.5,39.61023333,-7.908333333,Pwani,Mafia,Kilindoni,Kilindoni,Fungungombe,16,RN,Rastrelliger faughni,Mackerel,NA,400,20,34.7826087,34.7826087
04/04/2020,4,IN,2020-04-04T19:20:00Z,2020-04-05T06:50:00Z,11.5,39.36614,-5.07545,Pwani,Mafia,Kilindoni,Kilindoni,Fungungombe,16,RN,Rastrelliger faughni,Mackerel,Kibua maji(mboni),400,20,34.7826087,34.7826087
05/04/2020,4,IN,2020-04-05T19:00:00Z,2020-04-05T02:49:00Z,-16.18,39.20105,-4.89371,Tanga,Mkinga,Zingibari,Petukiza,Funguni,41,RN,Amblygaster sirm,Anchovy,NA,400,20,51.17270789,-24.72187886
05/04/2020,4,IN,2020-04-05T19:00:00Z,2020-04-06T05:30:00Z,10.5,39.66108,-5.06474,Pemba,Wete,Selemu,Wete Pwani,Fundo,18,RN,Decapterus macrosoma,Mackerel,Msumari,400,20,38.0952381,38.0952381
05/04/2020,4,IN,2020-04-05T19:30:00Z,2020-04-06T08:25:00Z,12.92,39.9517,-5.0745065,Pwani,Mafia,Kilindoni,Kilindoni,Chini,17,RN,Dagaa,Anchovy,Dagaa mchele,2000,100,154.7987616,154.7987616
05/04/2020,4,IN,2020-04-05T19:32:00Z,2020-04-06T06:18:00Z,10.77,40.37954,-10.30998,Mtwara,Mtwara Rural,Mnazi,Mnazi Bay,KITELELA,23,RN,Dussumieria acuta,Anchovy,NA,250,25,23.21981423,23.21262767
05/04/2020,4,IN,2020-04-05T19:32:00Z,2020-04-06T06:18:00Z,10.77,40.37954,-10.30998,Mtwara,Mtwara Rural,Mnazi,Mnazi Bay,KITELELA,23,RN,Dussumieria acuta,Anchovy,NA,250,25,23.21981423,23.21262767
06/04/2020,4,IN,2020-04-06T07:15:00Z,2020-04-06T11:30:00Z,4.25,40.33109,-10.3342,Mtwara,Mtwara Rural,Mnazi,Mnazi Bay,KIWALE,18,RN,Dussumieria acuta,Anchovy,NA,150,10,35.29411765,35.29411765
06/04/2020,4,IN,2020-04-06T18:30:00Z,2020-04-07T05:30:00Z,11,39.66108,-5.064474,Pemba,Wete,Selemu,Wete Pwani,Fundo,18,RN,Decapterus macrosoma,Mackerel,Msumari,160,8,14.54545455,14.54545455
06/04/2020,4,IN,2020-04-06T23:42:00Z,2020-04-07T05:26:00Z,5.73,40.37448,-10.31507,Mtwara,Mtwara Rural,Mnazi,Mnazi Bay,BWANAOGA,19,RN,Dussumieria acuta,Anchovy,NA,105,10,18.31395349,18.32460733
07/04/2020,4,IN,2020-04-07T05:45:00Z,2020-04-07T09:28:00Z,3.72,39.26648,-6.71996,Dar es Salaam,Kinondoni,Kunduchi Pwani,Kunduchi Pwani,Bongoyo,55,RN,Sardine,Sardines,NA,200,10,53.81165919,53.76344086
07/04/2020,4,IN,2020-04-07T06:10:00Z,2020-04-07T09:20:00Z,3.17,39.2671,-6.72142,Dar es Salaam,Kinondoni,Kunduchi Pwani,Kunduchi Pwani,Bongoyo,55,RN,Sardine,Sardines,NA,100,5,31.57894737,31.54574132
07/04/2020,4,IN,2020-04-07T07:12:00Z,2020-04-07T11:27:00Z,4.25,40.37448,-10.31507,Mtwara,Mtwara Rural,Mnazi,Mnazi Bay,BWANAOGA,26,RN,Dussumieria acuta,Anchovy,NA,170,10,40,40
07/04/2020,4,IN,2020-04-07T07:30:00Z,2020-04-07T11:30:00Z,4,39.22413,-4.74185,Tanga,Mkinga,Zingibari,Petukiza,Mnyahani,21,RN,Dussumieria acuta,Anchovy,NA,60,3,15,15
07/04/2020,4,IN,2020-04-07T07:30:00Z,2020-04-07T11:30:00Z,4,39.26768,-4.74897,Tanga,Mkinga,Zingibari,Petukiza,Bunju,19,RN,Dussumieria acuta,Anchovy,NA,500,50,125,125
07/04/2020,4,IN,2020-04-07T07:30:00Z,2020-04-07T11:00:00Z,3.5,39.24747,-4.75915,Tanga,Mkinga,Zingibari,Petukiza,Bunju,20,RN,Dussumieria acuta,Anchovy,NA,500,50,142.8571429,142.8571429
07/04/2020,4,IN,2020-04-07T08:30:00Z,2020-04-07T12:30:00Z,4,39.24613,-4.75915,Tanga,Mkinga,Zingibari,Petukiza,Puju,20,RN,Dussumieria acuta,Anchovy,NA,200,10,50,50
